index	genre	filename	year	old_index	source1	source2	sentence1	sentence2	score
1606	main_captions	MSRvid	2019	1607	none	none	A man with a hard hat is dancing	The man with a hard hat is dancing	1
297	main_captions	MSRvid	2019	298	none	none	A cat is moving away from some corn	A cat is eating some corn	0
1602	main_captions	MSRvid	2019	1603	none	none	A woman is grating carrots	Carrots are being grated by a woman	1
295	main_captions	MSRvid	2019	296	none	none	An animal is rolling around in the garden	A dog is rolling around	0
1601	main_captions	MSRvid	2019	1602	none	none	Two people are walking with loaded baskets and colorful blankets.	Two people are walking with loaded baskets and blankets.	1
293	main_captions	MSRvid	2019	294	none	none	Someone is feeding an animal	No one is feeding an animal	0
1600	main_captions	MSRvid	2019	1601	none	none	A woman is slicing a green pepper	The woman with a knife is slicing a pepper	1
289	main_captions	MSRvid	2019	290	none	none	The woman wearing silver pants with pink bell-bottom and a red scarf is happily riding a bicycle	A woman wearing a pink boa is riding a bicycle across a pedestrian bridge	0
1599	main_captions	MSRvid	2019	1600	none	none	A black dog is jumping from a rock in a pond	A black dog is jumping from a dock to a pond	1
288	main_captions	MSRvid	2019	289	none	none	A white man is strolling a dog through the brown water with difficulty	A white and brown dog is struggling through the water	0
1598	main_captions	MSRvid	2019	1599	none	none	The person is riding a motorcycle on a sandy track	The person is driving a motorcycle on a sand trail	1
287	main_captions	MSRvid	2019	288	none	none	A man is dancing	A man is singing passionately	0
1597	main_captions	MSRvid	2019	1598	none	none	A woman is peeling a potato	The woman is peeling a potato	1
285	main_captions	MSRvid	2019	286	none	none	One is carefully slicing a potato	The man is slicing the potato	0
1596	main_captions	MSRvid	2019	1597	none	none	A girl is combing her hair	A girl is combing her hair	1
283	main_captions	MSRvid	2019	284	none	none	There&#39;s no man riding a mechanical bull	A man is riding a mechanical bull.	0
1595	main_captions	MSRvid	2019	1596	none	none	A frog is being handled by the woman	The woman is thumbing a frog	1
279	main_captions	MSRvid	2019	280	none	none	Some kids are jumping on a trampoline.	Two boys are playing on a trampoline	0
1592	main_captions	MSRvid	2019	1593	none	none	A man is cleaning the rim of a bowl	A man is cleaning the rim of the bowl	1
278	main_captions	MSRvid	2019	279	none	none	A black helmet is being worn by a man pushing a bike	A biker is wearing a gear that is black	0
1591	main_captions	MSRvid	2019	1592	none	none	Two dogs are fighting for a frisbee in a lake	Two brown dogs are playing with a frisbee in the water	1
275	main_captions	MSRvid	2019	276	none	none	There is no dog running and carrying an object in its mouth	One dog is chasing another and is holding a stick in its mouth	0
1587	main_captions	MSRvid	2019	1588	none	none	The brown dog is jumping in the air	The brown animal is jumping in the air	1
274	main_captions	MSRvid	2019	275	none	none	A crowd of people are near the water.	A group of children wearing the same clothes are waiting at a gate and one is kissing their mother	0
1586	main_captions	MSRvid	2019	1587	none	none	A boy is looking closely at the calendar	A boy is looking at a calendar	1
271	main_captions	MSRvid	2019	272	none	none	A man is sprinkling spice on several sliced and buttered breads.	A man is slicing some garlic and saving the bread	0
1585	main_captions	MSRvid	2019	1586	none	none	The squirrel is running in circles.	An animal is running in circles.	1
268	main_captions	MSRvid	2019	269	none	none	A woman is slicing a potato	A woman is slicing a carrot	0
1584	main_captions	MSRvid	2019	1585	none	none	The men are having a conversation	The men are talking	1
266	main_captions	MSRvid	2019	267	none	none	The woman is adding sugar to the meat	Woman is not adding sugar to meat	0
1582	main_captions	MSRvid	2019	1583	none	none	A man is playing the guitar	A guitar is being played by a man	1
264	main_captions	MSRvid	2019	265	none	none	The person is writing with a pencil	The writings are about a person drawing	0
1581	main_captions	MSRvid	2019	1582	none	none	A family is watching a small boy who is hitting a baseball	A child is hitting a baseball	1
263	main_captions	MSRvid	2019	264	none	none	Three boys are jumping in the leaves	Kids in red shirts are playing in the leaves	0
1580	main_captions	MSRvid	2019	1581	none	none	The person is writing with a pencil	A person is writing	1
262	main_captions	MSRvid	2019	263	none	none	A dog is running on the road	There&#39;s no man running on the road	0
1579	main_captions	MSRvid	2019	1580	none	none	A small girl is playing a grand piano on stage	A girl is playing the piano	1
255	main_captions	MSRvid	2019	256	none	none	The woman is holding the eggs	The woman is cracking eggs in a bowl	0
1578	main_captions	MSRvid	2019	1579	none	none	Two animals are running through the park	Two dogs are running fast through a park	1
253	main_captions	MSRvid	2019	254	none	none	Potato is being peeled by a woman	A woman is throwing a potato peel	0
1576	main_captions	MSRvid	2019	1577	none	none	A woman is slicing an eggplant	A woman is slicing a vegetable	1
251	main_captions	MSRvid	2019	252	none	none	A man is sitting near a bicycle and writing a note.	A seated man is busy writing something in an area covered by paint.	0
1575	main_captions	MSRvid	2019	1576	none	none	Snowboarder is boldly jumping over white snow	Snowboarder is jumping over from white snow.	1
250	main_captions	MSRvid	2019	251	none	none	A man is pointing to a silver sedan	A lonely man is in a parking lot and is playing tennis against a large wall	0
1572	main_captions	MSRvid	2019	1573	none	none	The woman is catching a kangaroo that is small	The woman is catching a kangaroo baby	1
249	main_captions	MSRvid	2019	250	none	none	A horse is riding on a man	A man is riding a horse	0
1571	main_captions	MSRvid	2019	1572	none	none	A man is eating food	A man is eating some food	1
248	main_captions	MSRvid	2019	249	none	none	A woman is cooking an egg in a sautese	A woman is pouring a mixture into a bowl and mixing it	0
1570	main_captions	MSRvid	2019	1571	none	none	A man is crouching and holding a camera	A person is crouching and holding the camera	1
246	main_captions	MSRvid	2019	247	none	none	The woman is thumbing a frog	There&#39;s no man holding a frog	0
1569	main_captions	MSRvid	2019	1570	none	none	A man is taking pictures of a lake	A man is attentively taking pictures of a lake	1
245	main_captions	MSRvid	2019	246	none	none	South African plane is flying in the blue sky	South African plane is not flying in a blue sky	0
1568	main_captions	MSRvid	2019	1569	none	none	A bee is clinging to a yellow flower.	A yellow flower is being grabbed by a bee	1
243	main_captions	MSRvid	2019	244	none	none	Blonde girl is dancing behind the stereo	The blonde girl is dancing in front of the stereo	0
1567	main_captions	MSRvid	2019	1568	none	none	A cat is crawling under a piece of furniture	An animal is crawling under a piece of furniture	1
242	main_captions	MSRvid	2019	243	none	none	A dress that is black, red, white and pink is being worn by a woman	A woman is taking off a very large cloak and revealing a fancy dress	0
1566	main_captions	MSRvid	2019	1567	none	none	Someone is drawing a person	The person is drawing	1
241	main_captions	MSRvid	2019	242	none	none	There&#39;s no woman beating eggs	A woman is mixing eggs	0
1565	main_captions	MSRvid	2019	1566	none	none	The group of people are sitting on the floor outside a monument	Some people are sitting on the floor outside a monument.	1
240	main_captions	MSRvid	2019	241	none	none	A man is pouring oil into a frying pan	A man is taking oil from a sautese	0
1564	main_captions	MSRvid	2019	1565	none	none	A black dog and a tiny white and black dog are looking up to a kitchen countertop.	Two dogs are looking at a kitchen worktop	1
237	main_captions	MSRvid	2019	238	none	none	The monkey is brushing a bulldog	The monkey is not brushing a bulldog	0
1563	main_captions	MSRvid	2019	1564	none	none	A black dog is jumping from a dock to a pond	A black dog is jumping from a dock into the water	1
236	main_captions	MSRvid	2019	237	none	none	Some bells are ringing near a cook slicing peppers	The person is dicing a pepper that is orange	0
1562	main_captions	MSRvid	2019	1563	none	none	Military officer is shouting at recruits	An officer is talking to the soldiers	1
235	main_captions	MSRvid	2019	236	none	none	A woman is applying makeup carefully	A band is singing loud	0
1561	main_captions	MSRvid	2019	1562	none	none	The man is carefully feeding a snake with a mouse	A snake is being fed by a mouse by a man.	1
232	main_captions	MSRvid	2019	233	none	none	A woman wearing a pink boa is riding a bicycle across a pedestrian bridge	Pink bell-bottom pants and pink scarf are not being worn by women with silver pants or people riding bikes	0
1559	main_captions	MSRvid	2019	1560	none	none	Different teams are playing soccer on the field	Two teams are playing field soccer	1
229	main_captions	MSRvid	2019	230	none	none	There&#39;s no dog licking a baby	A dog is licking a baby	0
1558	main_captions	MSRvid	2019	1559	none	none	An old woman is standing near a dog with white coat.	An old woman is standing near a white dog	1
226	main_captions	MSRvid	2019	227	none	none	You&#39;re not measuring another woman&#39;s ankle	You are measuring another woman&#39;s ankle	0
1557	main_captions	MSRvid	2019	1558	none	none	A group of children in the basement of a church are playing maracas and tambourines	A group of children in a basement of a building are playing maracas and tambourines	1
222	main_captions	MSRvid	2019	223	none	none	A bubble exploded, tinting the girl&#39;s shirt red	The girl in the red shirt is blowing a bubble	0
1556	main_captions	MSRvid	2019	1557	none	none	The woman is breaking two eggs in a bowl made of glass	The woman is breaking two eggs inside a glass bowl	1
219	main_captions	MSRvid	2019	220	none	none	A man is holding a guitar.	A man is passionately playing a guitar.	0
1555	main_captions	MSRvid	2019	1556	none	none	The man is slicing vegetables	Vegetables are being sliced by a man.	1
218	main_captions	MSRvid	2019	219	none	none	A talk about an adult and a boy is being given in an amphitheater	The man and the boy are standing under the stairs, which is outdoors	0
1554	main_captions	MSRvid	2019	1555	none	none	A potato is being peeled by a woman	A woman is peeling a potato	1
217	main_captions	MSRvid	2019	218	none	none	A man is performing a trick on a green bike	A black man in green is riding a bicycle	0
1553	main_captions	MSRvid	2019	1554	none	none	A trumpet is being played by one person	A person is playing the trumpet	1
215	main_captions	MSRvid	2019	216	none	none	A man is laughing	A man is crying	0
1552	main_captions	MSRvid	2019	1553	none	none	A person on a bicycle is jumping through the air and the sun is shining through the bicycle frame.	The person is flying through the air on the bike	1
212	main_captions	MSRvid	2019	213	none	none	Three people are standing beside a tree branch	Two kids are hanging on a large branch	0
1551	main_captions	MSRvid	2019	1552	none	none	A man is slowly dancing on the road.	A man is dancing on the road.	1
211	main_captions	MSRvid	2019	212	none	none	Two young small girls are sitting on the floor	Several children are sitting and raising their knees	0
1550	main_captions	MSRvid	2019	1551	none	none	A brown and white animal is jumping on the sidewalk	A brown and white dog is jumping on the sidewalk	1
209	main_captions	MSRvid	2019	210	none	none	An elderly woman is shirtless and is awkwardly knocking over two newspapers.	An old woman is wearing a shirt with rose patterns and is clumsily carrying two newspapers.	0
1543	main_captions	MSRvid	2019	1544	none	none	The person is writing	A person is writing	1
208	main_captions	MSRvid	2019	209	none	none	A woman is taking a can	A woman is cutting a tomato	0
1542	main_captions	MSRvid	2019	1543	none	none	Two boys are on the couch playing games on the television	Two boys on the couch are playing video games	1
207	main_captions	MSRvid	2019	208	none	none	The boss is carefully drying the oil from the frying pan	The boss is carefully pouring oil into a frying pan	0
1539	main_captions	MSRvid	2019	1540	none	none	People are walking outside a building that has many murals	People are walking outside the building that has several murals	1
205	main_captions	MSRvid	2019	206	none	none	A man is running down the road	A man is standing still	0
1538	main_captions	MSRvid	2019	1539	none	none	Two white dogs are running and jumping along the beach	Two dogs are playing on the beach	1
203	main_captions	MSRvid	2019	204	none	none	A man is dancing on a roof.	There&#39;s no man standing on a roof playing a violin	0
1537	main_captions	MSRvid	2019	1538	none	none	A child is surprisingly experiencing a new world.	A child is experiencing a new world.	1
199	main_captions	MSRvid	2019	200	none	none	A little child is drinking water from the cup.	The kitten is not eagerly drinking some milk from the bowl.	0
1534	main_captions	MSRvid	2019	1535	none	none	Man is making a handstand in the wet sand at the water&#39;s edge on the beach.	A man is holding a handstand at the beach	1
198	main_captions	MSRvid	2019	199	none	none	The man is driving a car	The driver&#39;s car is parked by a man	0
1532	main_captions	MSRvid	2019	1533	none	none	The woman is slicing herbs	A woman is slicing herbs	1
197	main_captions	MSRvid	2019	198	none	none	There&#39;s no man walking outside	A man is walking outside	0
1531	main_captions	MSRvid	2019	1532	none	none	Some people are dancing.	A group of people are dancing.	1
196	main_captions	MSRvid	2019	197	none	none	The lady is adding cheese to the sauce	A man is taking a plate of grated cheese from a sauce pan	0
1530	main_captions	MSRvid	2019	1531	none	none	A white horse is being ridden by a man in a blue cowboy hat	A man in a blue cowboy hat is riding a white horse.	1
192	main_captions	MSRvid	2019	193	none	none	A dog is eating a doll	A child is playing with a dog toy	0
1528	main_captions	MSRvid	2019	1529	none	none	A dog is chasing a ball in the grass	A ball is being chased by a dog in the grass	1
190	main_captions	MSRvid	2019	191	none	none	A woman wearing a pink boa is riding a bicycle across a pedestrian bridge	A pedestrian is building pink bicycles for bicycle riders	0
1526	main_captions	MSRvid	2019	1527	none	none	Two kids are playing field soccer in the park	Two kids are playing with a ball in the park	1
186	main_captions	MSRvid	2019	187	none	none	A group of people are equipped with safety equipment.	A person with cycling gear is standing facing some mountains	0
1525	main_captions	MSRvid	2019	1526	none	none	A group of people are standing around a soundboard.	A group of people are standing around a stereo	1
184	main_captions	MSRvid	2019	185	none	none	Two scared boys are talking on the phone	A woman is talking on a telephone	0
1524	main_captions	MSRvid	2019	1525	none	none	A man is carrying a tree.	A man is carrying a plant.	1
182	main_captions	MSRvid	2019	183	none	none	A woman is playing an electric guitar	A man is playing a guitar	0
1523	main_captions	MSRvid	2019	1524	none	none	A boy wearing red shorts is jumping in a kiddie pool	A child is wearing red shorts and is jumping in a kiddie pool	1
181	main_captions	MSRvid	2019	182	none	none	A boy is throwing away a calendar	A boy is looking at a calendar	0
1521	main_captions	MSRvid	2019	1522	none	none	A woman is putting skewers on a shelf.	The skewers are being placed on a shelf by a woman	1
180	main_captions	MSRvid	2019	181	none	none	The girl in the red shirt is blowing a bubble	The girl in a red-dyed shirt is not blowing a bubble	0
1520	main_captions	MSRvid	2019	1521	none	none	A man is shooting with a shotgun.	A man is shooting with a gun.	1
179	main_captions	MSRvid	2019	180	none	none	A man is not playing a guitar	A man is playing the keyboard	0
1518	main_captions	MSRvid	2019	1519	none	none	The man with brown hair is wearing sunglasses and is sitting passively at a table with soda cans and other drinks.	The man with brown hair is wearing sunglasses and is sitting at a table with soda cans and other drinks.	1
178	main_captions	MSRvid	2019	179	none	none	Four young men are standing still and a car is exploding behind them	The boys are standing in front of the burning car	0
1514	main_captions	MSRvid	2019	1515	none	none	The man is taking a picture of himself and another guy	A person is holding an electronic device.	1
171	main_captions	MSRvid	2019	172	none	none	Three women are standing still	Three women are dancing	0
1512	main_captions	MSRvid	2019	1513	none	none	A woman is amalgamating eggs	A woman is mixing eggs	1
169	main_captions	MSRvid	2019	170	none	none	The boys are not dancing in front of some people	Two men are making a funny skit with a boxer in front of a crowd of people.	0
1511	main_captions	MSRvid	2019	1512	none	none	The woman is catching a kangaroo baby	The lady is catching the kangaroo	1
167	main_captions	MSRvid	2019	168	none	none	Two crocodiles are swimming in a green pool near children playing.	Two kids are playing in a pool with a green colored crocodile float	0
1509	main_captions	MSRvid	2019	1510	none	none	A sheepdog is herding a flock of sheep	The sheepdog is herding a flock of sheep	1
158	main_captions	MSRvid	2019	159	none	none	A young boy is not climbing a wall made of stone	A small child is climbing a climbing wall within a covered area.	0
1506	main_captions	MSRvid	2019	1507	none	none	A guitar is being played by a man	A man is playing the guitar	1
157	main_captions	MSRvid	2019	158	none	none	A woman is breaking two eggs in a bowl	Some ingredients are being separated into a bowl by one person.	0
1503	main_captions	MSRvid	2019	1504	none	none	A woman wearing a blue shirt and high heels is standing on the sidewalk next to a man.	A woman wearing a blue shirt and high heels is standing on the sidewalk next to the man.	1
156	main_captions	MSRvid	2019	157	none	none	There&#39;s no woman preparing an egg in a sautese	A woman is pouring a mixture into a bowl and mixing it	0
1502	main_captions	MSRvid	2019	1503	none	none	An afraid little boy is on a climbing wall.	A little boy, who looks scared, is on a climbing wall	1
154	main_captions	MSRvid	2019	155	none	none	A man is performing a trick on a green bike	A man dressed in black is riding a bicycle	0
1500	main_captions	MSRvid	2019	1501	none	none	A baby is happily playing with a dog	A baby is playing with a dog	1
150	main_captions	MSRvid	2019	151	none	none	A girl is looking surprised from a front window of a house in Asia	An Asian girl in front of a brick window looks surprised	0
1499	main_captions	MSRvid	2019	1500	none	none	A man is on a ship in front of the sunset	A man is in a boat in front of the sunset	1
149	main_captions	MSRvid	2019	150	none	none	A teenage boy is talking to a girl with a webcam	A man is talking to a girl with an internet camera	0
1498	main_captions	MSRvid	2019	1499	none	none	A person is playing a piano	A piano is being played by one person	1
147	main_captions	MSRvid	2019	148	none	none	The man is dancing frantically	Three women are dancing	0
1497	main_captions	MSRvid	2019	1498	none	none	Two boys on the couch are playing video games	A couple of boys are playing a video game	1
145	main_captions	MSRvid	2019	146	none	none	Two men are taking a break from the trip on a snowy road.	Two men are holding bikes and standing beside a snow covered road	0
1496	main_captions	MSRvid	2019	1497	none	none	The girl is rubbing eyeliner on her eyelid	The girl is using an eye pencil on her eyelid	1
143	main_captions	MSRvid	2019	144	none	none	The man is cutting the tape in the box	A man is playing tape in a cut out box	0
1495	main_captions	MSRvid	2019	1496	none	none	The deer is jumping over a fence	A deer is jumping over the enclosure	1
140	main_captions	MSRvid	2019	141	none	none	There&#39;s no man cutting a paper plate	A man is cutting a paper board.	0
1493	main_captions	MSRvid	2019	1494	none	none	A woman is looking at the view of a city	The woman is looking at the view of a city	1
136	main_captions	MSRvid	2019	137	none	none	A woman is walking the dog on the street	A woman is holding the dog	0
1492	main_captions	MSRvid	2019	1493	none	none	Two people are carrying colorful baskets and blankets and walking next to a building.	Two people are walking with loaded baskets and blankets.	1
133	main_captions	MSRvid	2019	134	none	none	Some women are talking	Some women are not talking	0
1491	main_captions	MSRvid	2019	1492	none	none	A dog, which is large and gray, is carrying a ball in its mouth with difficulty and running through the grass.	A dog, which is large and gray, is carrying a ball in its mouth and running through the grass.	1
130	main_captions	MSRvid	2019	131	none	none	Mud is being thrown at boy playing	The boy is playing in the mud	0
1490	main_captions	MSRvid	2019	1491	none	none	The boy is playing a guitar	A boy is playing a guitar	1
129	main_captions	MSRvid	2019	130	none	none	The lady is not cutting the meat	The lady is cracking an egg for the mixer	0
1489	main_captions	MSRvid	2019	1490	none	none	A man is dancing upside down on the ceiling	A man is dancing on the ceiling of a room.	1
127	main_captions	MSRvid	2019	128	none	none	A girl is cutting butter in two pieces	Tofu is being sliced by a woman	0
1488	main_captions	MSRvid	2019	1489	none	none	Four people are sitting on a low cement railing	Some people are sitting on a low cement railing.	1
124	main_captions	MSRvid	2019	125	none	none	Two men with bikes stand on the side of a snowy road	Two men are taking a break from a trip on a snow-covered road.	0
1482	main_captions	MSRvid	2019	1483	none	none	A clown is singing and people are dancing	A clown is singing	1
123	main_captions	MSRvid	2019	124	none	none	A man is tearing pictures of a lake	The man is setting up the camera and taking pictures of the sunset at the beach	0
1480	main_captions	MSRvid	2019	1481	none	none	A cat is walking on the club floor	A cat is walking on a wooden floor	1
121	main_captions	MSRvid	2019	122	none	none	Two kids are pushing an inflatable crocodile in a pool	Two kids are playing in a pool with a green colored crocodile float	0
1479	main_captions	MSRvid	2019	1480	none	none	A small girl and woman wearing a yellow shirt are being watered by a city fountain.	A small girl and a woman wearing a yellow shirt are being wet near a fountain	1
119	main_captions	MSRvid	2019	120	none	none	A big dog is running on the grass with a tennis ball in its mouth	A dog, which is large and gray, is dropping a ball from its mouth and stopping in the grass	0
1478	main_captions	MSRvid	2019	1479	none	none	A shrewd badger is digging the earth	A badger is cunningly digging the earth	1
115	main_captions	MSRvid	2019	116	none	none	A woman is playing a guitar	There&#39;s no woman playing a guitar	0
1477	main_captions	MSRvid	2019	1478	none	none	A young child is running down a gravel road that is covered with dead leaves.	A young child is running outdoors on the fallen leaves.	1
113	main_captions	MSRvid	2019	114	none	none	A monkey is brushing the dog	There&#39;s no monkey brushing the dog	0
1476	main_captions	MSRvid	2019	1477	none	none	The man is driving a car carefully	The man is driving a car	1
112	main_captions	MSRvid	2019	113	none	none	A man is leading the race	Some men are running in competitions abroad.	0
1475	main_captions	MSRvid	2019	1476	none	none	A cat is playing a piano comically	A cat is playing a piano	1
111	main_captions	MSRvid	2019	112	none	none	People are not playing cricket	People are playing cricket	0
1474	main_captions	MSRvid	2019	1475	none	none	A student with a black bag is in a crowded train	A girl with a black bag is in a crowded train	1
109	main_captions	MSRvid	2019	110	none	none	There&#39;s no man holding a frog	A man is holding a frog	0
1473	main_captions	MSRvid	2019	1474	none	none	A cardboard box is being touched by a man with a black hat	A man with black hat is touching a cardboard box	1
108	main_captions	MSRvid	2019	109	none	none	A man is crying	A man is screaming	0
1469	main_captions	MSRvid	2019	1470	none	none	A yellow dog is running down a sandy path	A dog is running	1
107	main_captions	MSRvid	2019	108	none	none	The person is not drawing	A man is drawing a picture	0
1468	main_captions	MSRvid	2019	1469	none	none	A man in a red uniform is quickly jumping on a mountain bike race.	A man is participating in a bmx race	1
106	main_captions	MSRvid	2019	107	none	none	The man is playing a guitar	The man is not playing a guitar	0
1466	main_captions	MSRvid	2019	1467	none	none	A woman is frying some food	Some foods are being fried by a woman	1
105	main_captions	MSRvid	2019	106	none	none	A girl is not playing the guitar	The man is intensely playing the guitar	0
1463	main_captions	MSRvid	2019	1464	none	none	Several people are sitting around a campfire at night	Several people are gathered around the fire at night	1
103	main_captions	MSRvid	2019	104	none	none	A ping pong player meets two people	Some animals are playing in the water.	0
1462	main_captions	MSRvid	2019	1463	none	none	Some people in a drag race are looking at the flames coming out of the cars.	People in a drag race are looking at the flames coming out of the cars.	1
100	main_captions	MSRvid	2019	101	none	none	A plane is flying	A puppy is barking	0
1461	main_captions	MSRvid	2019	1462	none	none	A small child is splashing water inside a blue kiddie pool	The child is splashing water in a pool	1
99	main_captions	MSRvid	2019	100	none	none	A man is talking about the stage.	A man is speaking on a stage.	0
1460	main_captions	MSRvid	2019	1461	none	none	The children are wearing black pants and jumping	Some kids are wearing black pants and jumping	1
97	main_captions	MSRvid	2019	98	none	none	A squirrel is running in circles.	A runner is surrounding a squirrel	0
