index	genre	filename	year	old_index	source1	source2	sentence1	sentence2	score
1547	main_captions	MSRvid	2019	1548	none	none	A teen girl is holding beads that are red.	A young lady with light brown hair is wearing a red necklace, sweatshirt and earrings and is smiling	0
2376	main_captions	MSRvid	2019	2377	none	none	An older man and woman are riding a bicycle on the boardwalk near the water	A middle-aged man and woman are riding bicycles along a road beside the water.	1
1546	main_captions	MSRvid	2019	1547	none	none	A man is talking	A man is silent	0
2375	main_captions	MSRvid	2019	2376	none	none	A man is standing next to a bird cage that is large and colorful.	A man is standing next to a bird cage.	1
1545	main_captions	MSRvid	2019	1546	none	none	A brave artist is riding a motorcycle over a man in blue overalls	A man in blue overalls is bravely riding a motorcycle	0
2374	main_captions	MSRvid	2019	2375	none	none	A cat is jumping into a container	A cat is jumping in a box	1
1544	main_captions	MSRvid	2019	1545	none	none	There&#39;s no man playing the guitar	A woman is putting on lipstick	0
2373	main_captions	MSRvid	2019	2374	none	none	A group of boys are playing with a ball in front of a large wooden door.	The children are playing in front of a very large door.	1
1541	main_captions	MSRvid	2019	1542	none	none	A woman is walking the dog on the street	The woman is not walking the dog	0
2372	main_captions	MSRvid	2019	2373	none	none	The man is taking a picture of himself and another guy	A picture of himself and another guy is being taken by the man	1
1540	main_captions	MSRvid	2019	1541	none	none	Someone is playing a piano	There&#39;s nobody playing a piano	0
2369	main_captions	MSRvid	2019	2370	none	none	A sea turtle is looking for fish	A sea turtle is looking for food	1
1536	main_captions	MSRvid	2019	1537	none	none	A man is playing a guitar	A man in a hat is playing the harp	0
2367	main_captions	MSRvid	2019	2368	none	none	A person is wrapping a tortilla	A tortilla is being folded by one person	1
1535	main_captions	MSRvid	2019	1536	none	none	The girl is riding a horse	The man is riding a horse	0
2366	main_captions	MSRvid	2019	2367	none	none	A woman is wearing a hearing protector and is firing a gun on a covered shooting range.	A woman is shooting a practice target	1
1533	main_captions	MSRvid	2019	1534	none	none	A skinny lady is arranging cut oriental carrots together	A woman is slicing a carrot	0
2365	main_captions	MSRvid	2019	2366	none	none	A squirrel is running in circles.	An animal is running in circles.	1
1529	main_captions	MSRvid	2019	1530	none	none	There&#39;s no woman rubbing a zucchini with a vegetable brush	A person is rubbing a zucchini	0
2364	main_captions	MSRvid	2019	2365	none	none	Orange rescue boat is running through the water	The rescue boat, which is orange, is running through the water.	1
1527	main_captions	MSRvid	2019	1528	none	none	There&#39;s no man in the hat playing the harp	A man in a hat is playing the harp	0
2363	main_captions	MSRvid	2019	2364	none	none	Snowboarder is jumping over from white snow.	Snowboarder jumps in the air	1
1522	main_captions	MSRvid	2019	1523	none	none	Snowboarder is not jumping over from white snow	Snowboarder is jumping over from white snow.	0
2362	main_captions	MSRvid	2019	2363	none	none	The machine is sharpening the end of a pencil	A pencil is being sharpened	1
1519	main_captions	MSRvid	2019	1520	none	none	The man is giving an interview	There&#39;s no white car being driven by man	0
2361	main_captions	MSRvid	2019	2362	none	none	The woman is cracking eggs in a bowl	Eggs are being cracked in a bowl by the woman	1
1517	main_captions	MSRvid	2019	1518	none	none	A large group of Asian people are eating in a restaurant.	A group of people in a large Asian restaurant are eating.	0
2360	main_captions	MSRvid	2019	2361	none	none	Two women are dancing and singing in front of a crowd	The women are singing and dancing	1
1516	main_captions	MSRvid	2019	1517	none	none	A man in a cap is playing the harp	A man is playing a guitar	0
2359	main_captions	MSRvid	2019	2360	none	none	A chubby-faced boy is wearing sunglasses	Sunglasses are being worn by a boy	1
1515	main_captions	MSRvid	2019	1516	none	none	No one is practicing water rescue and wearing life jackets	This group of people are practicing water rescue and wearing life jackets.	0
2358	main_captions	MSRvid	2019	2359	none	none	A man is singing and playing a guitar	A man is playing a guitar	1
1513	main_captions	MSRvid	2019	1514	none	none	The woman is eating	There&#39;s no woman beating eggs	0
2355	main_captions	MSRvid	2019	2356	none	none	The soccer player is kicking the ball between someone&#39;s legs	A person is kicking a soccer field ball between someone&#39;s feet	1
1510	main_captions	MSRvid	2019	1511	none	none	Someone is peeling a banana	There&#39;s nobody peeling a banana	0
2353	main_captions	MSRvid	2019	2354	none	none	A woman cheerleader is sitting on the knee of a man cheerleader	A woman cheerleader is sitting on a man&#39;s knee	1
1508	main_captions	MSRvid	2019	1509	none	none	A man is slicing a bread	There&#39;s no man slicing a bread	0
2351	main_captions	MSRvid	2019	2352	none	none	The lady is stirring meat in a bowl	A lady is mixing a meat mixture in a bowl.	1
1507	main_captions	MSRvid	2019	1508	none	none	Few people are eating at red tables in a dimly lit restaurant	Several people are eating at red tables in a crowded restaurant with purple lights	0
2350	main_captions	MSRvid	2019	2351	none	none	A woman is cutting meat	There&#39;s no woman chopping an onion	1
1505	main_captions	MSRvid	2019	1506	none	none	A man is spitting	There&#39;s no spitting man	0
2348	main_captions	MSRvid	2019	2349	none	none	A man is slicing a carrot confidently with the knife	A man is cutting a carrot with a knife	1
1504	main_captions	MSRvid	2019	1505	none	none	The man is cutting the tape in the box	The man is not cutting the box ribbon	0
2347	main_captions	MSRvid	2019	2348	none	none	A man is doing exercises.	A person is doing exercises.	1
1501	main_captions	MSRvid	2019	1502	none	none	A man is exercising	A baby is laughing	0
2346	main_captions	MSRvid	2019	2347	none	none	The woman is breaking two eggs inside a glass bowl	A woman is breaking an egg in a bowl	1
1494	main_captions	MSRvid	2019	1495	none	none	A cat is swinging on a fan	A cat is trapped in a moving ceiling fan	0
2345	main_captions	MSRvid	2019	2346	none	none	The lady is carefully slicing the meat	The lady is slicing the meat	1
1487	main_captions	MSRvid	2019	1488	none	none	A man is talking	The man is dancing	0
2344	main_captions	MSRvid	2019	2345	none	none	A man is performing with a guitar	A man is playing a guitar	1
1486	main_captions	MSRvid	2019	1487	none	none	Someone is boiling okra in a pan	Someone is being boiled with okra in a pan	0
2342	main_captions	MSRvid	2019	2343	none	none	A biker is riding a motorcycle dangerously down the highway	A biker is riding the motorcycle along the highway	1
1485	main_captions	MSRvid	2019	1486	none	none	A man is typing on a machine used for shorthand	The man is not operating a stenographer	0
2339	main_captions	MSRvid	2019	2340	none	none	A small boy is singing and playing the guitar	The small child is singing and playing guitar	1
1484	main_captions	MSRvid	2019	1485	none	none	The man is stirring the oil	The man is stirring the sauce for the chicken	0
2337	main_captions	MSRvid	2019	2338	none	none	A large duck is flying over a rocky stream.	A seabird is flying over some rocks	1
1483	main_captions	MSRvid	2019	1484	none	none	Someone is falling off a horse	Someone is on a horse	0
2336	main_captions	MSRvid	2019	2337	none	none	Several young people are posing for a photo and holding beers	Several young people are posing for a photo and holding drinks	1
1481	main_captions	MSRvid	2019	1482	none	none	A person is stroking a cat&#39;s fur	A person is combing a cat&#39;s fur	0
2335	main_captions	MSRvid	2019	2336	none	none	A man is climbing upwards on a rope.	The man is climbing up a rope	1
1472	main_captions	MSRvid	2019	1473	none	none	A man is speaking at a podium	A man is thanking on a stage in front of a crowd	0
2334	main_captions	MSRvid	2019	2335	none	none	A dog with a muzzle and a blue jacket is running around the yard.	A dog with a blue blanket is running across the grass	1
1471	main_captions	MSRvid	2019	1472	none	none	The presentation is not being attended by a student classroom.	The presentation is being attended by a class of students.	0
2332	main_captions	MSRvid	2019	2333	none	none	A police officer is sitting on a motorcycle	The policeman is sitting on the police bike	1
1470	main_captions	MSRvid	2019	1471	none	none	A person is cutting an onion	There is no person cutting an onion	0
2331	main_captions	MSRvid	2019	2332	none	none	A woman is clumsily putting meat in a frying pan	A woman is putting meat in a frying pan	1
1467	main_captions	MSRvid	2019	1468	none	none	Two spectators are fighting kickboxing and some people are watching	Two people are fighting kickboxing and spectators are watching	0
2330	main_captions	MSRvid	2019	2331	none	none	A man is jumping from a low wall	A man is jumping over a wall	1
1465	main_captions	MSRvid	2019	1466	none	none	The horse is being ridden by the girl	The girl is spraying the plants with water	0
2328	main_captions	MSRvid	2019	2329	none	none	A white race car is going through a puddle	A white racing vehicle is going through a puddle	1
1464	main_captions	MSRvid	2019	1465	none	none	An old woman is standing near a white dog	A woman and a dog are sitting quietly on a tree stump.	0
2327	main_captions	MSRvid	2019	2328	none	none	A dog is swimming behind a tennis ball	A dog is swimming behind the ball	1
1458	main_captions	MSRvid	2019	1459	none	none	A piano is being played by a man	A boy is happily playing a piano	0
2326	main_captions	MSRvid	2019	2327	none	none	A man and a woman are talking	A man and a woman are having a conversation.	1
1455	main_captions	MSRvid	2019	1456	none	none	A band is singing	A woman is carefully removing her makeup.	0
2324	main_captions	MSRvid	2019	2325	none	none	The child is playing with the outdoor water fountain and the rest of the family is watching	A child is playing with a water spout outdoors and the rest of his family is watching	1
1452	main_captions	MSRvid	2019	1453	none	none	A karate practitioner is kicking another man who is wearing protective boxing gloves.	The man is not practicing kickboxing with a coach	0
2322	main_captions	MSRvid	2019	2323	none	none	A woman is cooking empanada pork chop	The woman is frying a breaded pork chop	1
1449	main_captions	MSRvid	2019	1450	none	none	A toy train is hitting a toy car	A car and a train are hitting a toy	0
2321	main_captions	MSRvid	2019	2322	none	none	A cat is opening a drawer and jumping in.	A cat is opening a drawer and climbing inside	1
1447	main_captions	MSRvid	2019	1448	none	none	An angry man is aiming at a chimpanzee kicking	The woman is pouring oil in a sautese	0
2318	main_captions	MSRvid	2019	2319	none	none	The girl in the black hat is wearing a bikini on the beach	A girl in a black hat is wearing a bikini at the beach	1
1445	main_captions	MSRvid	2019	1446	none	none	The person is dicing a pepper that is orange	A cook is quickly slicing some peppers	0
2314	main_captions	MSRvid	2019	2315	none	none	A small child is sitting in a seat	A small child is sitting	1
1440	main_captions	MSRvid	2019	1441	none	none	A man is leading the race	A man is leading the final part of the race.	0
2312	main_captions	MSRvid	2019	2313	none	none	A fish is being cut by a man	A man is cutting a fish	1
1439	main_captions	MSRvid	2019	1440	none	none	A man with climbing gear is hanging on a vertical white rock	A woman with a ponytail is going down a stone wall	0
2307	main_captions	MSRvid	2019	2308	none	none	The boy is mowing the grass near the sidewalk with scissors	A boy is mowing the lawn with shears	1
1434	main_captions	MSRvid	2019	1435	none	none	A small girl is looking at a fantasy woman	A little fantasy girl looks like a woman	0
2306	main_captions	MSRvid	2019	2307	none	none	A white dog is standing in the leaves on the ground.	A dog, which is white, is standing in the fallen leaves.	1
1428	main_captions	MSRvid	2019	1429	none	none	A boy is standing out of the water	A boy is standing in the water	0
2304	main_captions	MSRvid	2019	2305	none	none	The man is sitting on the floor in a room and strumming a guitar	A man is sitting on the floor and is playing a guitar	1
1424	main_captions	MSRvid	2019	1425	none	none	A boy is filling a jug with water	A woman is emptying the water from a mug	0
2302	main_captions	MSRvid	2019	2303	none	none	The white dog wearing reindeer ears is near a brown dog	The white dog wearing reindeer ears is next to a brown dog	1
1423	main_captions	MSRvid	2019	1424	none	none	A boy is hitting a man with a toy gun	A boy is hitting a man with a sword	0
2301	main_captions	MSRvid	2019	2302	none	none	A chef is cooking a meal	A chef is preparing some food	1
1418	main_captions	MSRvid	2019	1419	none	none	A white-haired cat, perched in a small wooden closet, is looking out the window.	The cat perched on the table is looking out the window	0
2300	main_captions	MSRvid	2019	2301	none	none	The parrot is surprisingly speaking into the microphone.	A parrot is talking	1
1414	main_captions	MSRvid	2019	1415	none	none	Someone is feeding an animal	Someone is playing the piano	0
2299	main_captions	MSRvid	2019	2300	none	none	A girl is playing a flute	A wind instrument is being played by a girl	1
1411	main_captions	MSRvid	2019	1412	none	none	A man is taking pictures of a lake	The man is putting aside the camera and walking away from the beach.	0
2298	main_captions	MSRvid	2019	2299	none	none	Students are filling the classroom	A classroom is full of students	1
1409	main_captions	MSRvid	2019	1410	none	none	Children in red shirts are sleeping in the sheets	Three kids are jumping on the leaves	0
2297	main_captions	MSRvid	2019	2298	none	none	The lady is peeling the potato	A potato is being peeled by a woman	1
1403	main_captions	MSRvid	2019	1404	none	none	An Asian woman among many people is carrying a black bag	A girl with a black bag is in a crowded train	0
2296	main_captions	MSRvid	2019	2297	none	none	The man is riding a horse near a current	A man is riding a horse	1
1400	main_captions	MSRvid	2019	1401	none	none	A man is resting	A man is exercising	0
2295	main_captions	MSRvid	2019	2296	none	none	Several people are passing the border of a bridge	Many people are walking in line across a bridge.	1
1399	main_captions	MSRvid	2019	1400	none	none	Four girls are making bridges and playing in a covered area	Four kids are bridging the park	0
2294	main_captions	MSRvid	2019	2295	none	none	A man is wearing a straw hat and smoking a cigarette.	The man in the straw hat is smoking a cigarette	1
1398	main_captions	MSRvid	2019	1399	none	none	A man is playing a flute	An electronic keyboard is being played by a man	0
2293	main_captions	MSRvid	2019	2294	none	none	Someone is beating an egg	An individual is beating an egg	1
1396	main_captions	MSRvid	2019	1397	none	none	A man is holding a guitar.	Someone is playing the guitar	0
2290	main_captions	MSRvid	2019	2291	none	none	A man is dancing with a used helmet	A man with a hard hat is dancing	1
1387	main_captions	MSRvid	2019	1388	none	none	The man is holding bread	The woman is slicing herbs	0
2288	main_captions	MSRvid	2019	2289	none	none	A man is eating a bowl of cereal.	Cereal is being eaten by man	1
1382	main_captions	MSRvid	2019	1383	none	none	A man is singing and playing a guitar	A boy is playing a piano	0
2287	main_captions	MSRvid	2019	2288	none	none	A furry brown dog is crossing the grassy area	The brown dog is playing outdoors	1
1380	main_captions	MSRvid	2019	1381	none	none	A climbing boy saves the fearful cat over the fence	An afraid little boy is on a climbing wall.	0
2285	main_captions	MSRvid	2019	2286	none	none	A woman in a dyed yellow shirt is surfing on a pink surfboard.	A surfer is riding the wave	1
1379	main_captions	MSRvid	2019	1380	none	none	There&#39;s no man cutting a paper plate	The man is cutting a paper plate	0
2284	main_captions	MSRvid	2019	2285	none	none	A child is walking down the street and a jeep is approaching	A child is coming down the street and a jeep is stopping	1
1375	main_captions	MSRvid	2019	1376	none	none	The woman is playing an acoustic guitar and singing	The woman is not playing an acoustic guitar or singing	0
2283	main_captions	MSRvid	2019	2284	none	none	The girl is recklessly jumping into a car	The girl is recklessly jumping into a vehicle	1
1374	main_captions	MSRvid	2019	1375	none	none	The doctor is helping the patient	Doctors aren&#39;t reviving a man	0
2282	main_captions	MSRvid	2019	2283	none	none	The man is riding a mountain bike	A man on a bike is riding on a lonely wheel	1
1373	main_captions	MSRvid	2019	1374	none	none	The horse is being ridden by a man	A man is riding a motorcycle	0
2279	main_captions	MSRvid	2019	2280	none	none	A dog is playing alone on a snow covered beach	A dog is playing alone on the snow-covered coast.	1
1371	main_captions	MSRvid	2019	1372	none	none	A man is playing a guitar	Someone is putting the guitar over there	0
2278	main_captions	MSRvid	2019	2279	none	none	A man is riding a motorcycle around the city	A man is riding a motorcycle	1
1370	main_captions	MSRvid	2019	1371	none	none	A woman is caressing a lemur	Someone is scratching an animal&#39;s belly	0
2276	main_captions	MSRvid	2019	2277	none	none	Two men are making a funny skit with a boxer in front of a crowd of people.	Two men are doing a very funny sketch with a boxer in front of a crowd of people	1
1368	main_captions	MSRvid	2019	1369	none	none	A woman is cutting a white onion	A horse is standing	0
2274	main_captions	MSRvid	2019	2275	none	none	Broccoli is being stung by a woman	A woman is chopping broccoli	1
1361	main_captions	MSRvid	2019	1362	none	none	A herd of reindeer is crossing a road.	A herd of deer is crossing the street.	0
2273	main_captions	MSRvid	2019	2274	none	none	A man is frying a tortilla	A man is frying food	1
1354	main_captions	MSRvid	2019	1355	none	none	Children in red shirts are playing in the leaves	Three kids are jumping on the leaves	0
2269	main_captions	MSRvid	2019	2270	none	none	People are playing cricket	Some people are playing cricket	1
1349	main_captions	MSRvid	2019	1350	none	none	Two men are playing table tennis	A woman is dancing alone	0
2264	main_captions	MSRvid	2019	2265	none	none	A kitten is playing with a blue toy rope	A kitten is playing with a toy.	1
1346	main_captions	MSRvid	2019	1347	none	none	A man is playing a guitar	A woman is playing a guitar	0
2261	main_captions	MSRvid	2019	2262	none	none	The deer is jumping over the low fence	The deer is jumping over the fence	1
1340	main_captions	MSRvid	2019	1341	none	none	A woman is thinking of a man	A man is thinking	0
2258	main_captions	MSRvid	2019	2259	none	none	A container is being shaken over a sink in the kitchen by a man	A man is shaking a container over a sink in the kitchen	1
1337	main_captions	MSRvid	2019	1338	none	none	A woman is cutting prawns	A man is chopping butter in a container	0
2256	main_captions	MSRvid	2019	2257	none	none	A man is looking at the horizon and people are walking through buildings behind him.	A person is looking far away and people are walking between buildings behind	1
1335	main_captions	MSRvid	2019	1336	none	none	A man is dancing	A man is still	0
2255	main_captions	MSRvid	2019	2256	none	none	The piano is being played by someone	Someone is playing the piano	1
1334	main_captions	MSRvid	2019	1335	none	none	A woman is putting aside a lemon	A woman is squeezing juice from a lemon.	0
2254	main_captions	MSRvid	2019	2255	none	none	A young child with black hair is taking a picture with a camera	A young child with black hair is taking a picture with a camera	1
1332	main_captions	MSRvid	2019	1333	none	none	Kittens in trays are being eaten as food for an advertisement.	Some kittens are eating.	0
2253	main_captions	MSRvid	2019	2254	none	none	A brown dog is jumping over a red obstacle	A red obstacle is being jumped by a big brown dog	1
1329	main_captions	MSRvid	2019	1330	none	none	A teenager is playing the guitar	A child is playing a guitar	0
2251	main_captions	MSRvid	2019	2252	none	none	A person is burning some cameras with a blowtorch	The person is setting the cameras on fire	1
1327	main_captions	MSRvid	2019	1328	none	none	A man doing a pose is being watched by another man	There is no man doing a pose being watched by another man	0
2250	main_captions	MSRvid	2019	2251	none	none	Someone is drilling a hole in a piece of wood with a drill	Someone is drilling a hole in a wood strip with a drill	1
1326	main_captions	MSRvid	2019	1327	none	none	A person in a black blouse is doing tricks on a motorcycle	A man in a black jacket is doing tricks on a motorcycle	0
2248	main_captions	MSRvid	2019	2249	none	none	A monkey is riding a bicycle	A monkey is riding a bike	1
1325	main_captions	MSRvid	2019	1326	none	none	A man is failing to do a bike trick in midair	The cyclist is performing a trick in the air.	0
2247	main_captions	MSRvid	2019	2248	none	none	The lady is breaking eggs that are raw in a bowl	The woman is cracking eggs in a bowl	1
1323	main_captions	MSRvid	2019	1324	none	none	A rhino baby and his mother are standing in a cage	A baby rhino is following an adult rhino	0
2246	main_captions	MSRvid	2019	2247	none	none	A person is quickly cutting mushrooms with a knife.	A man is quickly mincing some mushrooms with a knife	1
1322	main_captions	MSRvid	2019	1323	none	none	A dog is moving away from a baby	A dog is licking a baby	0
2245	main_captions	MSRvid	2019	2246	none	none	Someone is boiling okra in a pan	An individual is boiling okra in a pan	1
1321	main_captions	MSRvid	2019	1322	none	none	A man is slicing some garlic and saving the bread	A man is putting garlic on some bread slices	0
2243	main_captions	MSRvid	2019	2244	none	none	The boy is playing the piano	The boy is playing a musical instrument	1
1320	main_captions	MSRvid	2019	1321	none	none	The person is not riding a motorcycle on a sandy track	The person is riding a motorcycle on a sandy track	0
2240	main_captions	MSRvid	2019	2241	none	none	People are clustered around a campfire at night	People are sitting around a campfire at night.	1
1318	main_captions	MSRvid	2019	1319	none	none	The dog is pushing a boy into the water	A dog is pushing a small child into a rain puddle	0
2239	main_captions	MSRvid	2019	2240	none	none	An old man is sitting on a bench	An old person is sitting on a bench	1
1316	main_captions	MSRvid	2019	1317	none	none	There&#39;s no man playing a keyboard	A man is playing the keyboard	0
2237	main_captions	MSRvid	2019	2238	none	none	A woman is using a sewing machine.	A woman is sewing with a machine	1
1309	main_captions	MSRvid	2019	1310	none	none	A girl is combing the tail hair of a little pony	A man is sitting on the chair	0
2236	main_captions	MSRvid	2019	2237	none	none	The boys are chasing each other in the sand	The boys are chasing each other in the sand	1
1307	main_captions	MSRvid	2019	1308	none	none	The small child is playing soccer and falling on the grass	A soccer player is falling on the grass to dodge a small child	0
2235	main_captions	MSRvid	2019	2236	none	none	A boy is sitting comfortably in a room and playing the piano near a lamp	A boy is sitting in a room and is playing the piano next to a lamp	1
1305	main_captions	MSRvid	2019	1306	none	none	The man is slicing a tomato	A woman is slicing a carrot	0
2233	main_captions	MSRvid	2019	2234	none	none	A person is absently cutting mushrooms with a knife	A person is cutting mushrooms with a knife.	1
1304	main_captions	MSRvid	2019	1305	none	none	The man is eating cereal	There&#39;s no man eating cereal	0
2231	main_captions	MSRvid	2019	2232	none	none	This person is cutting an onion	A person is cutting an onion	1
1302	main_captions	MSRvid	2019	1303	none	none	There&#39;s no man chopping a log with an ax	The man is chopping a tree trunk with an ax	0
2229	main_captions	MSRvid	2019	2230	none	none	A cat is stuck in the shovel of a moving fan	A cat is trapped in a moving ceiling fan	1
1301	main_captions	MSRvid	2019	1302	none	none	A man is wearing a black helmet and pushing a bike	A cyclist wearing black is breaking the gears	0
2224	main_captions	MSRvid	2019	2225	none	none	The man is standing stably beside a bird cage	A man is standing next to a bird cage.	1
1300	main_captions	MSRvid	2019	1301	none	none	Rhino is being fed in the grass	A rhino is grazing in a field	0
2221	main_captions	MSRvid	2019	2222	none	none	One dog is catching a stick in the air and another is watching	One dog is jumping high in the air and another is watching	1
1297	main_captions	MSRvid	2019	1298	none	none	A woman is slicing meat with a knife	There&#39;s no woman slicing meat with a knife	0
2220	main_captions	MSRvid	2019	2221	none	none	A small girl is hitting a baseball in a stand	A small girl is hitting a ball in a stand	1
1295	main_captions	MSRvid	2019	1296	none	none	A man is playing an electric guitar.	A man is playing the keyboard	0
2218	main_captions	MSRvid	2019	2219	none	none	Tall person is setting the cameras on fire	The person is setting the cameras on fire	1
1293	main_captions	MSRvid	2019	1294	none	none	The person is riding a motorcycle on a sandy track	A motocross rider is giving a motorcycle to a person at an event.	0
2216	main_captions	MSRvid	2019	2217	none	none	The man is typing on a machine used for shorthand	A man is typing on a machine used for shorthand	1
1289	main_captions	MSRvid	2019	1290	none	none	A cat is playing a piano	There are no cats playing keyboards	0
2215	main_captions	MSRvid	2019	2216	none	none	Two panda babies are playing	Two puppies are playing	1
1288	main_captions	MSRvid	2019	1289	none	none	A crowd of people are near the water.	A group of children in uniforms are standing at a gate and one is kissing their mother	0
