index	genre	filename	year	old_index	source1	source2	sentence1	sentence2	score
3971	main_captions	MSRvid	2019	3972	none	none	A bell pepper is being cut into pieces by one person	The person is slicing a garlic clove into pieces	0
3976	main_captions	MSRvid	2019	3977	none	none	The man is eating	The person is eating	1
3965	main_captions	MSRvid	2019	3966	none	none	A horse is flinging the cowboy wearing blue and red pants	A man is putting a cape on a wild horse that is falling on the track.	0
3975	main_captions	MSRvid	2019	3976	none	none	An old woman is wearing a shirt with rose patterns and is clumsily carrying two newspapers.	An old woman is wearing a shirt with a rose pattern and is clumsily carrying two newspapers.	1
3964	main_captions	MSRvid	2019	3965	none	none	A person is cutting some mushrooms	There is no person cutting some mushrooms	0
3974	main_captions	MSRvid	2019	3975	none	none	A black dog is jumping from one hay ball to another hay ball	A black dog is jumping from one hay ball to another hay ball	1
3958	main_captions	MSRvid	2019	3959	none	none	A woman is putting the baby in a trash can	A person is putting meat in a sautese	0
3973	main_captions	MSRvid	2019	3974	none	none	A man is dancing	A man is performing a dance	1
3957	main_captions	MSRvid	2019	3958	none	none	A boy is filling a jug with water	A woman is collecting tap water in a mug	0
3972	main_captions	MSRvid	2019	3973	none	none	A person is folding a piece of paper.	Someone is folding a piece of paper.	1
3954	main_captions	MSRvid	2019	3955	none	none	A soccer player is kicking the ball into the goal	A soccer ball is not rolling into a goal net	0
3970	main_captions	MSRvid	2019	3971	none	none	A black cat is swinging on a fan	A cat is swinging on a fan	1
3953	main_captions	MSRvid	2019	3954	none	none	A dog is playing excitedly with water in a field	The dog is snapping a few drops of water	0
3969	main_captions	MSRvid	2019	3970	none	none	A woman is collecting tap water in a mug	A woman is collecting water from a tap in a mug	1
3951	main_captions	MSRvid	2019	3952	none	none	A man is breaking a wooden hand against a board.	A man is breaking tiles with his hands.	0
3968	main_captions	MSRvid	2019	3969	none	none	The man is riding a horse near a stream	A horse is being ridden by a man	1
3950	main_captions	MSRvid	2019	3951	none	none	A person is performing a card trick	No one is performing a card trick	0
3967	main_captions	MSRvid	2019	3968	none	none	One boy is jumping off a platform and two other boys are standing and watching	One boy is jumping off a platform and two other boys are standing and staring at him.	1
3947	main_captions	MSRvid	2019	3948	none	none	The woman is stirring eggs in a bowl	Someone is beating an egg	0
3966	main_captions	MSRvid	2019	3967	none	none	The man in the white hat is playing the guitar on stage	A man in a white hat is playing guitar on the stage.	1
3946	main_captions	MSRvid	2019	3947	none	none	There&#39;s no kid holding a water gun	A child is holding a water gun	0
3963	main_captions	MSRvid	2019	3964	none	none	The person is brushing a cat	A person is brushing a cat	1
3944	main_captions	MSRvid	2019	3945	none	none	A white and brown dog is struggling through the water	There are no white and brown dogs struggling anxiously in the water.	0
3962	main_captions	MSRvid	2019	3963	none	none	The blonde girl is dancing in front of the stereo	The outfit in front of the dancing blonde girl is playing	1
3943	main_captions	MSRvid	2019	3944	none	none	A little monkey is walking by the water	A monkey is not walking by the water	0
3961	main_captions	MSRvid	2019	3962	none	none	Some cat is playing with a watermelon	A cat is playing with a watermelon	1
3941	main_captions	MSRvid	2019	3942	none	none	The woman is wearing glasses and a black cap	The woman with a black hat is wearing sunglasses	0
3960	main_captions	MSRvid	2019	3961	none	none	Men are fighting their fists in a ring	Two men are fighting their fists in a ring	1
3940	main_captions	MSRvid	2019	3941	none	none	A jumping practitioner is throwing a person&#39;s snowboard through the air.	Snowboarder jumps in the air	0
3959	main_captions	MSRvid	2019	3960	none	none	The man is seasoning the sausages	The man is seasoning the meat	1
3939	main_captions	MSRvid	2019	3940	none	none	The man is not slicing vegetables	A woman is slicing a potato	0
3956	main_captions	MSRvid	2019	3957	none	none	A dog is pushing a small child into a rain puddle	The dog is pushing a boy into the water	1
3938	main_captions	MSRvid	2019	3939	none	none	There&#39;s no man sitting on the floor playing the guitar	A man is sitting on the floor in a room and is strumming a guitar	0
3955	main_captions	MSRvid	2019	3956	none	none	Two people are sitting on lawn chairs and are reading books.	Some people are sitting on lawn chairs and are reading books.	1
3937	main_captions	MSRvid	2019	3938	none	none	A small girl is looking at a fantasy woman	Small girl is looking at a fantasy man	0
3952	main_captions	MSRvid	2019	3953	none	none	Two people wearing snow clothes are on the ground making snow angels	Two people in snow clothes are lying in the snow and are making snow angels	1
3936	main_captions	MSRvid	2019	3937	none	none	There&#39;s no lady mixing a meat mixture in a bowl	A lady is mixing a meat mixture in a bowl.	0
3949	main_captions	MSRvid	2019	3950	none	none	A woman in a red dress is playing an instrument	An instrument is being played by a woman in a red dress	1
3933	main_captions	MSRvid	2019	3934	none	none	Mountaineering equipment is firmly positioned in front of standing cyclist	A group of people are equipped with safety equipment.	0
3948	main_captions	MSRvid	2019	3949	none	none	A man is burying a basketball in the basket and a crowd is in the background.	The player is burying the basketball and a crowd is in the background	1
3932	main_captions	MSRvid	2019	3933	none	none	A man is talking	A man is dancing	0
3945	main_captions	MSRvid	2019	3946	none	none	The woman is catching and holding a kangaroo baby	A woman is holding and holding a kangaroo, which is a baby, in her arms.	1
3928	main_captions	MSRvid	2019	3929	none	none	Several ferrets are climbing into the cage.	Several ferrets are climbing out of the cage	0
3942	main_captions	MSRvid	2019	3943	none	none	The woman is frying a breaded pork chop	A woman is cooking a pork chop that is breaded	1
3926	main_captions	MSRvid	2019	3927	none	none	A man is slicing a carrot confidently with the knife	The woman is slicing an onion	0
3935	main_captions	MSRvid	2019	3936	none	none	Eggs are being cracked in a bowl by a woman	A woman is cracking eggs in a bowl	1
3924	main_captions	MSRvid	2019	3925	none	none	There&#39;s no woman dancing	The man is dancing	0
3934	main_captions	MSRvid	2019	3935	none	none	The woman is playing the flute	The flute is being played by the woman	1
3919	main_captions	MSRvid	2019	3920	none	none	Some men in a competition are running abroad.	The man is running to reach the leadership	0
3931	main_captions	MSRvid	2019	3932	none	none	The man is lifting weights	The weights are being lifted by the man.	1
3918	main_captions	MSRvid	2019	3919	none	none	A man is dropping a guitar	A man is playing a guitar	0
3930	main_captions	MSRvid	2019	3931	none	none	A young woman is playing the guitar	A girl is playing the guitar	1
3917	main_captions	MSRvid	2019	3918	none	none	The man is lifting weights	The man is lowering bars	0
3929	main_captions	MSRvid	2019	3930	none	none	People are walking down a busy street.	People are walking down a crowded street	1
3915	main_captions	MSRvid	2019	3916	none	none	A person is sitting in a field and is wearing a hat	A man is sitting in a field	0
3927	main_captions	MSRvid	2019	3928	none	none	A man is wearing a protective helmet and dancing.	A man with a hard hat is dancing	1
3914	main_captions	MSRvid	2019	3915	none	none	There&#39;s no person slicing a carrot into pieces	A person is slicing a carrot into pieces	0
3925	main_captions	MSRvid	2019	3926	none	none	The brown-haired dog is playing outdoors	The brown dog is playing outdoors	1
3911	main_captions	MSRvid	2019	3912	none	none	A lonely cyclist is jumping in the air	A man is jumping in an empty pool	0
3923	main_captions	MSRvid	2019	3924	none	none	Two men are standing near the water and are holding fishing rods	Two men are holding fishing rods	1
3910	main_captions	MSRvid	2019	3911	none	none	A man is doing some tricks with a soccer ball	A man is kicking a soccer ball on the pitch	0
3922	main_captions	MSRvid	2019	3923	none	none	A man is jumping in an empty swimming pool	A man is jumping in an empty pool	1
3909	main_captions	MSRvid	2019	3910	none	none	A person is wearing a hat and is sitting on the grass.	There is no person wearing a hat and sitting on the grass	0
3921	main_captions	MSRvid	2019	3922	none	none	A young girl is sitting in a bathing suit	A young girl is sitting in a swimming outfit	1
3906	main_captions	MSRvid	2019	3907	none	none	There&#39;s no boy holding a fishing rod and running in front of a fish	A boy is hanging a fishing rod and running in front of a fish	0
3920	main_captions	MSRvid	2019	3921	none	none	A brown dog is running down a snowy path	A dog is running on a snowy path.	1
3900	main_captions	MSRvid	2019	3901	none	none	A man is kicking a soccer ball on the pitch	The contents of a bowl are being mixed by a man.	0
3916	main_captions	MSRvid	2019	3917	none	none	A woman is clumsily putting meat in a frying pan	Meat is being poured into a frying pan	1
3895	main_captions	MSRvid	2019	3896	none	none	The animal with big eyes is eating	A lemur is eating	0
3913	main_captions	MSRvid	2019	3914	none	none	A dog is in the sand that is spreading in the air	A dog is in the sand being blown by the wind	1
3894	main_captions	MSRvid	2019	3895	none	none	A woman is preparing an egg in a sautese	A woman is pouring a mixture into a bowl and mixing it	0
3912	main_captions	MSRvid	2019	3913	none	none	A man and a woman are walking pleasantly.	A woman and a man are walking	1
3890	main_captions	MSRvid	2019	3891	none	none	Two spectators are fighting kickboxing and some people are watching	Two women are fighting in a kickboxing match	0
3908	main_captions	MSRvid	2019	3909	none	none	Four Middle Eastern children, three girls and one boy, are climbing into the cave with a pink interior.	A group of children are playing in a structure that is colorful.	1
3885	main_captions	MSRvid	2019	3886	none	none	A monkey is angrily kicking a target	Sautese is being greased by a woman who is pouring some water	0
3907	main_captions	MSRvid	2019	3908	none	none	A silky gray dog is sleeping in the grass and a brown dog is looking	A gray silky dog is lying on the grass and a brown dog is looking	1
3884	main_captions	MSRvid	2019	3885	none	none	Two people are playing ping pong	A ping pong player meets two people	0
3905	main_captions	MSRvid	2019	3906	none	none	The squirrel is running in circles.	A squirrel is running in circles.	1
3883	main_captions	MSRvid	2019	3884	none	none	Tofu is being sliced by a woman	A girl is cutting the butter in two pieces	0
3904	main_captions	MSRvid	2019	3905	none	none	A man is opening a tiny package containing headphones	A man is opening a package containing headphones	1
3881	main_captions	MSRvid	2019	3882	none	none	A baby rhino is walking around a cage with its mother	A mother is giving her baby a corral with a walking rhino.	0
3903	main_captions	MSRvid	2019	3904	none	none	A dog is opening a can of food	A dog is biting a can	1
3879	main_captions	MSRvid	2019	3880	none	none	A woman is breaking an egg in a bowl	The woman is putting a bowl with a crack near an egg	0
3902	main_captions	MSRvid	2019	3903	none	none	A man is pushing the buttons of a microwave	The buttons of a microwave are being pressed by a man	1
3874	main_captions	MSRvid	2019	3875	none	none	There&#39;s no boy playing a piano	A boy is playing a piano	0
3901	main_captions	MSRvid	2019	3902	none	none	A flute is being played by a girl	A girl is playing a wind instrument	1
3872	main_captions	MSRvid	2019	3873	none	none	A woman is slicing a clove of garlic	A woman is slicing a large pepper.	0
3899	main_captions	MSRvid	2019	3900	none	none	Cereal is being eaten by man	The man is eating cereal	1
3871	main_captions	MSRvid	2019	3872	none	none	The soccer ball is between the feet of a boy who is lying on the grass	A soccer player is falling on the grass to dodge a small child	0
3898	main_captions	MSRvid	2019	3899	none	none	A monkey is kicking a person	A person is being kicked by a monkey	1
3870	main_captions	MSRvid	2019	3871	none	none	An old woman is standing near a white dog	An old woman is far from a white dog	0
3897	main_captions	MSRvid	2019	3898	none	none	A man and a woman are walking through the woods	The man and the woman are walking through the woods	1
3867	main_captions	MSRvid	2019	3868	none	none	A man is holding a guitar.	A man is playing a guitar	0
3896	main_captions	MSRvid	2019	3897	none	none	The pepper is being sliced by a woman with a knife	A woman is slicing a green pepper	1
3866	main_captions	MSRvid	2019	3867	none	none	A man is shooting guns	A woman is riding a horse	0
3893	main_captions	MSRvid	2019	3894	none	none	The woman is cutting cooked octopus	A woman is cutting an octopus	1
3864	main_captions	MSRvid	2019	3865	none	none	A man is carefully climbing a rope.	A panda is climbing	0
3892	main_captions	MSRvid	2019	3893	none	none	A person is slicing an onion	An onion is being sliced by one person	1
3863	main_captions	MSRvid	2019	3864	none	none	A bicycle is being pedaled by a man	A monkey is riding a bicycle	0
3891	main_captions	MSRvid	2019	3892	none	none	A boy is looking at a calendar	The boy is examining a calendar	1
3862	main_captions	MSRvid	2019	3863	none	none	A woman is mixing eggs	The woman is drinking	0
3889	main_captions	MSRvid	2019	3890	none	none	A black dog is jumping from a rock in a pond	A black dog is jumping from a dock into the water	1
3861	main_captions	MSRvid	2019	3862	none	none	An old woman is wearing a shirt with rose patterns and is clumsily carrying two newspapers.	A newspaper is presenting a woman with big hands holding sunglasses and wearing a coat	0
3888	main_captions	MSRvid	2019	3889	none	none	A flute is being played adorable by a girl	A woman is playing the flute	1
3856	main_captions	MSRvid	2019	3857	none	none	The man is hammering a nail with a camera	Someone is nailing a camera lens with loud noises	0
3887	main_captions	MSRvid	2019	3888	none	none	A man is breaking tiles with his hands.	Tiles are being broken with his hands by a man	1
3846	main_captions	MSRvid	2019	3847	none	none	Three boys in karate uniforms are fighting	Three men are practicing karate in a field	0
3886	main_captions	MSRvid	2019	3887	none	none	Hay is being eaten by a cow	A cow is eating grass	1
3843	main_captions	MSRvid	2019	3844	none	none	A teenage boy is not talking to a girl with a webcam	A teenage boy is talking to a girl with a webcam	0
3882	main_captions	MSRvid	2019	3883	none	none	A potato is being cut by a man	A man is cutting a potato	1
3841	main_captions	MSRvid	2019	3842	none	none	A man is holding the guitar.	The man is playing the flute	0
3880	main_captions	MSRvid	2019	3881	none	none	A small child in a pink sweater is climbing a concrete ladder.	A little child in a pink sweater is climbing a concrete staircase.	1
3836	main_captions	MSRvid	2019	3837	none	none	There&#39;s no guinea pig eating a carrot	A guinea pig is eating a carrot	0
3878	main_captions	MSRvid	2019	3879	none	none	A woman in a dyed yellow shirt is surfing on a pink surfboard.	A woman in a yellow shirt is surfing on a pink board	1
3834	main_captions	MSRvid	2019	3835	none	none	The piano is being played by someone	Someone is feeding an animal	0
3877	main_captions	MSRvid	2019	3878	none	none	The elephant is being ridden by the woman	The woman is riding elephant	1
3833	main_captions	MSRvid	2019	3834	none	none	The man is drawing	The man is not drawing	0
3876	main_captions	MSRvid	2019	3877	none	none	A large group of cheerleaders are walking in a parade.	Many cheerleaders are walking in the parade	1
3832	main_captions	MSRvid	2019	3833	none	none	There&#39;s no girl jumping in the car	A girl is jumping in the car	0
3875	main_captions	MSRvid	2019	3876	none	none	Young girl is blowing a bubble that is big	The girl, who is young, is blowing a bubble that is huge	1
3831	main_captions	MSRvid	2019	3832	none	none	A man is sitting on a chair and rubbing his eyes.	A tattooed man is on a couch and is holding a pencil	0
3873	main_captions	MSRvid	2019	3874	none	none	A woman in purple clothes is taking a bicycle between two stone columns	A woman in a purple blouse is riding a bicycle between two stone columns.	1
3825	main_captions	MSRvid	2019	3826	none	none	The person is quickly slicing a vegetable	Someone is slicing a tomato	0
3869	main_captions	MSRvid	2019	3870	none	none	A man is climbing the cliff with a rope.	A man is climbing a cliff with a rope.	1
3823	main_captions	MSRvid	2019	3824	none	none	The man is on the ride with the horse	The horse is being ridden by a man	0
3868	main_captions	MSRvid	2019	3869	none	none	One person, who is topless and with a backpack, stands in front of a pile of rocks and clouds in the background.	A topless person with a backpack stands in front of a pile of rocks and clouds are in the background.	1
3821	main_captions	MSRvid	2019	3822	none	none	A couple is running towards the water	A man and a woman are running together and holding hands.	0
3865	main_captions	MSRvid	2019	3866	none	none	A woman is driving a car and is talking to the man who is sitting next to her	The woman and the man are traveling by car	1
3820	main_captions	MSRvid	2019	3821	none	none	There&#39;s no man being hit	A boy is hitting a man with a plastic sword	0
3860	main_captions	MSRvid	2019	3861	none	none	Orange juice is being drunk by a man who is walking on a sunny day.	A man is drinking orange juice and walking on a sunny day.	1
3813	main_captions	MSRvid	2019	3814	none	none	A man in blue overalls is failing to fly a motorcycle	A man in blue overalls is bravely riding a motorcycle	0
3859	main_captions	MSRvid	2019	3860	none	none	The man is playing the piano with his nose	A man is touching the keyboard with his nose	1
3812	main_captions	MSRvid	2019	3813	none	none	The bride is leaving the groom after the wedding	The bride and groom are leaving after the wedding	0
3858	main_captions	MSRvid	2019	3859	none	none	A man is dangerously throwing knives at the tree.	A man is dangerously throwing knives at a tree.	1
3811	main_captions	MSRvid	2019	3812	none	none	A man is sitting comfortably at the table.	There&#39;s no man wearing a dyed black shirt sitting at the table and laughing	0
3857	main_captions	MSRvid	2019	3858	none	none	Broccoli are being cut by a woman	A woman is cutting broccoli	1
3810	main_captions	MSRvid	2019	3811	none	none	A man at the keyboard is playing with his nose	The man is playing the piano with his nose	0
3855	main_captions	MSRvid	2019	3856	none	none	A family is watching a small boy who is hitting a baseball	A family is watching a boy hitting a baseball	1
3809	main_captions	MSRvid	2019	3810	none	none	Three teenagers are dying in the bedroom	Some teens are dancing for the camera.	0
3854	main_captions	MSRvid	2019	3855	none	none	A man is riding a horse	The person is riding a horse	1
3808	main_captions	MSRvid	2019	3809	none	none	A girl is cutting butter in two pieces	Some slices of tofu are being eaten by a woman.	0
3853	main_captions	MSRvid	2019	3854	none	none	A man is spreading butter on a large loaf of bread	A large piece of bread is having butter passed by a man	1
3805	main_captions	MSRvid	2019	3806	none	none	There&#39;s no woman casting a shadow	The woman is casting shadow	0
3852	main_captions	MSRvid	2019	3853	none	none	A child is practicing with an instrument.	A child is playing an instrument	1
3804	main_captions	MSRvid	2019	3805	none	none	A cartoon plane is landing	A cartoon plane is taking off	0
3851	main_captions	MSRvid	2019	3852	none	none	Children in red shirts are playing in the leaves	Kids in red shirts are playing in the leaves	1
3802	main_captions	MSRvid	2019	3803	none	none	A brown dog is attacking another animal in front of the man in pants	There are no dogs fighting and hugging	0
3850	main_captions	MSRvid	2019	3851	none	none	A man is holding a mask in his raised hand.	A mask is being held by a man in his raised hand.	1
3801	main_captions	MSRvid	2019	3802	none	none	Two dogs are playing near a tree	Two dogs are sleeping near a tree	0
3849	main_captions	MSRvid	2019	3850	none	none	A brown and white dog is playing in the grass	A dog is playing in the green grass	1
3800	main_captions	MSRvid	2019	3801	none	none	The man and the boy are standing under the stairs, which is outdoors	An adult is in the amphitheater and is seriously talking with a boy.	0
3848	main_captions	MSRvid	2019	3849	none	none	A black and white dog with a large branch is running on the grass.	A black and white dog is carrying a big stick in the green grass	1
3797	main_captions	MSRvid	2019	3798	none	none	There&#39;s no man driving the car	A man is driving a car.	0
3847	main_captions	MSRvid	2019	3848	none	none	A boy is looking closely at the calendar	A boy is checking a calendar	1
3792	main_captions	MSRvid	2019	3793	none	none	A cyclist is on the black and white bicycle and is standing on the saddle.	A biker is standing on the seat of a white motorcycle	0
3845	main_captions	MSRvid	2019	3846	none	none	A skateboarder is performing stunts on the track.	A skateboarder is doing tricks on a track.	1
3791	main_captions	MSRvid	2019	3792	none	none	People are singing and a clown is dancing	A clown is singing and people are dancing	0
3844	main_captions	MSRvid	2019	3845	none	none	A yellow kayak is being sailed by a man and a young boy	A man and a young boy are riding in a yellow kayak	1
3782	main_captions	MSRvid	2019	3783	none	none	A woman is cracking some eggs in a bowl	A woman is removing ingredients from a bowl.	0
3842	main_captions	MSRvid	2019	3843	none	none	A group of people are holding drinks and pointing at the camera.	Drinks are being held by people pointing at the camera.	1
3777	main_captions	MSRvid	2019	3778	none	none	A panda is climbing	A man is untying a rope	0
3840	main_captions	MSRvid	2019	3841	none	none	A man is resting on a chair and rubbing his eyes.	A man is sitting on a chair and rubbing his eyes.	1
3775	main_captions	MSRvid	2019	3776	none	none	Two small children are eating in a very tiny cart full of curls	Two young children are eating rolls	0
3839	main_captions	MSRvid	2019	3840	none	none	A man is showing a wee monkey	A man is displaying a wee monkey	1
3774	main_captions	MSRvid	2019	3775	none	none	A woman is chopping broccoli	The woman is chopping garlic	0
3838	main_captions	MSRvid	2019	3839	none	none	The panda bear is resting on the logs	The panda bear is lying on the trunks	1
3772	main_captions	MSRvid	2019	3773	none	none	A man is pushing the buttons of a microwave	A man is being pushed toward the buttons of a microwave	0
3837	main_captions	MSRvid	2019	3838	none	none	Two women are wearing bikinis and are walking on the sand	Two women are wearing bikinis on the sandy beach	1
3770	main_captions	MSRvid	2019	3771	none	none	The man is riding a horse	A horse is riding on a man	0
3835	main_captions	MSRvid	2019	3836	none	none	A rhino, which is a cub, is walking through the corral with its mother.	A baby rhino is walking around a cage with its mother	1
3768	main_captions	MSRvid	2019	3769	none	none	The man is lifting weights	The man is not lifting weights	0
3830	main_captions	MSRvid	2019	3831	none	none	A pencil is being sharpened by the machine	A machine is sharpening a pencil	1
3767	main_captions	MSRvid	2019	3768	none	none	A fish is swimming	A fish is not swimming	0
3829	main_captions	MSRvid	2019	3830	none	none	A man is playing the guitar	A man is playing a guitar	1
3766	main_captions	MSRvid	2019	3767	none	none	Men are fighting their fists in a ring	Men are not fighting their fists in a ring	0
3828	main_captions	MSRvid	2019	3829	none	none	A young girl is using sign language	A girl is using sign language	1
3762	main_captions	MSRvid	2019	3763	none	none	No one is beating an egg	Someone is beating an egg	0
3827	main_captions	MSRvid	2019	3828	none	none	A man wearing a dyed black shirt is sitting at the table and laughing	A black shirt is being worn by a man who is sitting at the table and laughing	1
3761	main_captions	MSRvid	2019	3762	none	none	A man stands on a rock above some trees and is standing in a strange position.	A hiker is on top of the mountain and is dancing	0
3826	main_captions	MSRvid	2019	3827	none	none	A man is cooking a snake	A man is roasting a snake	1
3759	main_captions	MSRvid	2019	3760	none	none	Two teams are competing in a soccer match	Two teams are competing in a baseball game	0
3824	main_captions	MSRvid	2019	3825	none	none	A person is pouring olive oil into a pan on the stove	A person is pouring cooking oil into a pan	1
3757	main_captions	MSRvid	2019	3758	none	none	Two dogs of different breeds are looking across the street.	A dog, which is black, and a white are ignoring each other on the street.	0
3822	main_captions	MSRvid	2019	3823	none	none	A white cat perched on a tiny wooden closet is looking out the window.	The cat perched on the table is looking curiously out the window	1
3754	main_captions	MSRvid	2019	3755	none	none	A young topless woman is covered in paint.	A naked lady is walking in front of several people with body painting.	0
3819	main_captions	MSRvid	2019	3820	none	none	A small boy with brown hair is jumping from the brown chair to the floor.	A young boy is jumping from a chair	1
3750	main_captions	MSRvid	2019	3751	none	none	There&#39;s no dog chasing another or holding a stick in its mouth	One dog is chasing another and is holding a stick in its mouth	0
3818	main_captions	MSRvid	2019	3819	none	none	The man is abruptly knocked off a horse	Someone is falling off a horse	1
3749	main_captions	MSRvid	2019	3750	none	none	A girl is brushing her hair	A girl is combing her hair	0
