index	genre	filename	year	old_index	source1	source2	sentence1	sentence2	score
1739	main_captions	MSRvid	2019	1740	none	none	Carne está sendo picada em pedaços por uma mulher	Uma mulher está cortando carne em pedaços	4.8
1735	main_captions	MSRvid	2019	1736	none	none	Algum peixe está nadando	Um peixe está nadando	4.9
1733	main_captions	MSRvid	2019	1734	none	none	Uma menina, que é pequena, está tocando um piano de cauda no palco	Uma menina está tocando o piano	4.1
1732	main_captions	MSRvid	2019	1733	none	none	Um jovem homem em uma bicicleta bmx está pulando em uma rampa de alvenaria	Um ciclista está pulando em uma rampa em forma de pirâmide	4.3
1731	main_captions	MSRvid	2019	1732	none	none	Um cachorro está olhando ao redor	Um animal está olhando ao redor	4.6
1730	main_captions	MSRvid	2019	1731	none	none	O menino, que é jovem, está atravessando as ondas do mar	Uma criança está correndo para dentro e para fora das ondas oceânicas	4.4
1729	main_captions	MSRvid	2019	1730	none	none	Um macaco está chutando a mão enluvada de uma pessoa	Um macaco está chutando a luva de uma pessoa	4.365
1727	main_captions	MSRvid	2019	1728	none	none	Uma menina, que é pequena, com cabelo loiro está sorrindo e sentada em um balanço	Uma pequena menina com cabelos loiros está sorrindo e sentada em um balanço	4.8
1724	main_captions	MSRvid	2019	1725	none	none	Um homem está ligando o micro-ondas	Um homem está apertando os botões de um micro-ondas	4.3
1723	main_captions	MSRvid	2019	1724	none	none	Uma vaca está comendo grama	Uma vaca está pastando	4.5
1721	main_captions	MSRvid	2019	1722	none	none	Uma mulher está cavalgando um cavalo marrom	Uma mulher está andando a cavalo	4.4
1720	main_captions	MSRvid	2019	1721	none	none	Crianças pequenas estão brincando em uma fonte de água na frente de poucas pessoas	As crianças estão brincando em uma fonte que está espirrando água do chão	4.1
1717	main_captions	MSRvid	2019	1718	none	none	Um homem está descuidadamente espalhando manteiga em um pão de alho	O homem está espalhando descuidadamente a manteiga em uma fatia de pão de alho	4.8
1713	main_captions	MSRvid	2019	1714	none	none	Um golden retriever está correndo	Um cachorro está correndo	4.4
1712	main_captions	MSRvid	2019	1713	none	none	Um leão está cansadamente andando ansiosamente em uma jaula	Um leão está andando lentamente	4.0
1711	main_captions	MSRvid	2019	1712	none	none	Um macaco está provocando um cachorro no zoológico	Um cachorro está sendo provocado por um macaco no zoológico	4.9
1710	main_captions	MSRvid	2019	1711	none	none	Um cachorro branco grande está pulando para cima na neve	Um grande animal branco está pulando para cima na neve	4.7
1709	main_captions	MSRvid	2019	1710	none	none	Um homem e uma mulher andam juntos através de áreas arborizadas	Um homem e uma mulher estão andando juntos pelo bosque	4.9
1708	main_captions	MSRvid	2019	1709	none	none	Um menino está de pé na frente do prédio pintado de azul, no espaço reservado para pessoas com deficiência	Um menino está em pé em frente ao edifício azul no espaço reservado para pessoas com deficiência	4.8
1705	main_captions	MSRvid	2019	1706	none	none	Um homem está fazendo um esboço	Um homem está desenhando	4.1
1704	main_captions	MSRvid	2019	1705	none	none	Uma pessoa não está rapidamente picando cogumelos com uma faca	Um homem está picando rapidamente alguns cogumelos com uma faca	4.0
1703	main_captions	MSRvid	2019	1704	none	none	A água está sendo esguichada por um homem na boca de um cachorro branco com uma pistola de água	Um homem está esguichando água na boca de um cachorro branco com uma pistola de água	4.8
1702	main_captions	MSRvid	2019	1703	none	none	Um homem está dançando lentamente na estrada	Um homem está dançando	4.4
1701	main_captions	MSRvid	2019	1702	none	none	Uma criança está vestindo um casaco e está carregando um trenó vermelho atrás de uma criança com um casaco verde e preto	Uma criança está vestindo um casaco e carregando um trenó vermelho perto de uma criança de casaco verde e preto	4.5
1699	main_captions	MSRvid	2019	1700	none	none	Uma mulher está esfregando uma abobrinha com uma escova para vegetais	Uma mulher está esfregando uma abobrinha com uma escova de vegetais	4.8
1697	main_captions	MSRvid	2019	1698	none	none	Duas crianças pequenas estão comendo enroladinho num carrinho que é muito pequenino	Duas crianças jovens estão comendo enroladinhos	4.3
1696	main_captions	MSRvid	2019	1697	none	none	Um cachorro está latindo para uma bola	Um animal está latindo para uma bola	4.2
1694	main_captions	MSRvid	2019	1695	none	none	Dois times estão competindo em uma partida de futebol	Futebol está sendo jogado por dois times concorrentes	4.8
1693	main_captions	MSRvid	2019	1694	none	none	O papagaio está falando no microfone	Um papagaio está falando	4.4
1690	main_captions	MSRvid	2019	1691	none	none	Um homem está conversando ao telefone	Um homem está dando um telefonema	4.3
1687	main_captions	MSRvid	2019	1688	none	none	Dois homens estão batalhando	Dois homens estão lutando	4.8
1686	main_captions	MSRvid	2019	1687	none	none	Dois cachorros estão correndo pela grama alta	Dois animais estão correndo pela grama alta	4.8
1684	main_captions	MSRvid	2019	1685	none	none	O pelo de um gato está sendo penteado por uma pessoa	Uma pessoa está escovando um gato	4.8
1683	main_captions	MSRvid	2019	1684	none	none	Uma mulher está pondo um bebê em uma lata de lixo	Uma mulher está pondo uma criança em uma lata de lixo	4.4
1682	main_captions	MSRvid	2019	1683	none	none	Uma mulher está dançando numa gaiola	A mulher está dançando	4.4
1680	main_captions	MSRvid	2019	1681	none	none	Uma cebola está sendo fatiada por uma mulher	Uma mulher está fatiando uma cebola	4.9
1678	main_captions	MSRvid	2019	1679	none	none	Pessoas estão andando por uma multidão na rua	As pessoas estão andando por uma rua movimentada	4.6
1677	main_captions	MSRvid	2019	1678	none	none	Um homem está pulando atleticamente uma parede	Um homem está pulando em uma parede baixa	4.0
1676	main_captions	MSRvid	2019	1677	none	none	Uma mulher está olhando para baixo e está vestindo um vestido de casamento	Uma mulher está olhando para baixo e está vestindo um véu de casamento	4.5
1673	main_captions	MSRvid	2019	1674	none	none	O gato pequeno está brincando com um brinquedo	Um filhote de gato está brincando com um brinquedo	4.8
1672	main_captions	MSRvid	2019	1673	none	none	Uma mulher está usando peças de fantasia e tinta e está andando de bicicleta em uma rua movimentada	Uma bicicleta está sendo pedalada por uma mulher usando peças de fantasia e tinta em uma rua movimentada	4.9
1671	main_captions	MSRvid	2019	1672	none	none	Um jovem homem em uma bicicleta bmx está pulando em uma rampa de alvenaria	Um homem jovem em uma bicicleta bmx está pulando de uma pirâmide de alvenaria	4.4
1669	main_captions	MSRvid	2019	1670	none	none	Um cachorro está latindo ruidosamente	Um cachorro está latindo	4.8
1668	main_captions	MSRvid	2019	1669	none	none	Um homem está bebendo suco de laranja e andando em um dia ensolarado	Uma pessoa está tomando suco de laranja e caminhando	4.4
1667	main_captions	MSRvid	2019	1668	none	none	Um homem está pulando em uma parede que é baixa	Um homem está pulando em uma parede baixa	4.8
1666	main_captions	MSRvid	2019	1667	none	none	Uma criança de laranja está brincando ao ar livre com uma bola de neve	Uma criança de laranja está brincando com uma bola de neve	4.8
1663	main_captions	MSRvid	2019	1664	none	none	Um homem e uma mulher estão comendo alegremente	Um homem e uma mulher estão comendo	4.0
1662	main_captions	MSRvid	2019	1663	none	none	Um cachorro preto está pulando de uma pedra em uma lagoa	Um animal preto está pulando de uma doca para a água	4.2
1661	main_captions	MSRvid	2019	1662	none	none	O homem está comendo uma banana perto de uma árvore	Uma banana está sendo comida por um homem	4.7
1658	main_captions	MSRvid	2019	1659	none	none	O homem não está fazendo exercícios de chão	O homem está fazendo exercícios no chão	4.1
1657	main_captions	MSRvid	2019	1658	none	none	Uma mulher está mostrando um filhote de cachorro para uma criança	Uma mulher está mostrando um cachorro pequenino para uma criança	4.3
1656	main_captions	MSRvid	2019	1657	none	none	Uma mulher está sentada e olhando para a cachoeira	Uma mulher está sentada e olhando para uma cachoeira	4.6
1655	main_captions	MSRvid	2019	1656	none	none	Uma criança está segurando uma pistola de água	Não tem nenhuma criança segurando uma pistola de água ou sendo pulverizada com água	4.085
1654	main_captions	MSRvid	2019	1655	none	none	Um menino molhado está alegremente pulando na grama suja e molhada	Um menino molhado está pulando pela grama suja e molhada	4.9
1652	main_captions	MSRvid	2019	1653	none	none	Um menino está de pé na água fria	Um menino está de pé na água	4.1
1651	main_captions	MSRvid	2019	1652	none	none	Algumas cebolas estão sendo cortadas por uma pessoa	Uma pessoa está fatiando algumas cebolas	4.9
1650	main_captions	MSRvid	2019	1651	none	none	A noiva e o noivo estão saindo depois do casamento	A noiva e o noivo estão partindo após o casamento	4.8
1647	main_captions	MSRvid	2019	1648	none	none	Um filhote de tigre está brincando com uma bola	Um bebê tigre está brincando com uma bola	4.9
1646	main_captions	MSRvid	2019	1647	none	none	Uma pessoa com uma blusa de capuz vermelha e uma mochila preta está andando próximo a uma parede rochosa	Uma pessoa com uma jaqueta vermelha com capuz e uma mochila preta está se movendo perto de uma parede rochosa	4.7
1645	main_captions	MSRvid	2019	1646	none	none	Uma pessoa está cortando distraidamente os cogumelos com uma faca	Uma pessoa está cortando alguns cogumelos	4.2
1644	main_captions	MSRvid	2019	1645	none	none	Um menino pequeno está pulando em uma poça na rua	Um menino pequeno está pulando numa poça na rua	4.9
1642	main_captions	MSRvid	2019	1643	none	none	Uma mulher está fatiando alho	Uma mulher está picando alho	4.4
1638	main_captions	MSRvid	2019	1639	none	none	Algum líquido está sendo derramado em uma frigideira por um homem	O homem está despejando líquido em uma panela	4.6
1636	main_captions	MSRvid	2019	1637	none	none	Um cachorro castanho e um cachorro cinza estão brincando na neve	Dois cachorros estão brincando na neve	4.6
1635	main_captions	MSRvid	2019	1636	none	none	Um homem está lendo o e-mail	Uma pessoa está lendo o e-mail	4.8
1628	main_captions	MSRvid	2019	1629	none	none	Um homem está comendo uma pizza	Um pouco de alimento está sendo comido por um homem	4.4
1627	main_captions	MSRvid	2019	1628	none	none	Uma jovem menina de collant azul está pulando no ar	Uma menina jovem de azul está pulando no ar	4.2
1626	main_captions	MSRvid	2019	1627	none	none	Um cavalo e seu cavaleiro estão pulando rapidamente sobre uma barreira	Um cavalo e seu cavaleiro estão saltando sobre uma barreira	4.4
1625	main_captions	MSRvid	2019	1626	none	none	Uma mulher está descascando uma batata	Uma mulher está descascando comida	4.3
1624	main_captions	MSRvid	2019	1625	none	none	Uma mulher com tranças está escalando uma parede de pedra	Uma mulher com um rabo de cavalo está subindo uma parede de pedra	4.2
1623	main_captions	MSRvid	2019	1624	none	none	Um músico está tocando dois teclados	Um homem está tocando dois teclados	4.2
1622	main_captions	MSRvid	2019	1623	none	none	Duas crianças estão espiando por cima de uma borda, que está enferrujada	Duas crianças estão olhando por um parapeito enferrujado	4.9
1620	main_captions	MSRvid	2019	1621	none	none	O homem e a mulher estão passeando	O homem e a mulher estão andando	4.5
1619	main_captions	MSRvid	2019	1620	none	none	Um menino jovem na camisa azul está pulando na água	O menino jovem de camisa azul está pulando para dentro da água	4.9
1618	main_captions	MSRvid	2019	1619	none	none	Um avião está decolando	Uma aeronave está decolando	4.9
1616	main_captions	MSRvid	2019	1617	none	none	O filhote de cachorro está brincando com um recipiente de plástico	O cachorro está brincando com um recipiente plástico	4.4
1613	main_captions	MSRvid	2019	1614	none	none	O violão está sendo tocado pelo homem	O violão está sendo tocado por um homem	4.9
1612	main_captions	MSRvid	2019	1613	none	none	Um cachorro preto em uma coleira está andando na água	Um cachorro de coleira está andando na água	4.7
1611	main_captions	MSRvid	2019	1612	none	none	Um cachorro caramelo sujo está rolando na sujeira e olhando diretamente para a câmera	Um cachorro está rolando no chão	4.2
1610	main_captions	MSRvid	2019	1611	none	none	Cinco crianças estão paradas em frente a uma cabana de madeira	Cinco crianças estão de pé em frente a uma cabana de madeira	4.8
1609	main_captions	MSRvid	2019	1610	none	none	Um homem está sentado em um trem e descansando a sua mão contra o rosto	O homem está sentado no trem e descansa a mão contra o rosto	4.9
1606	main_captions	MSRvid	2019	1607	none	none	Um homem com um chapéu duro está dançando	O homem com um chapéu duro está dançando	4.9
1601	main_captions	MSRvid	2019	1602	none	none	Duas pessoas estão andando com cestas carregadas e cobertores coloridos	Duas pessoas estão andando com cestas carregadas e cobertores	4.1
1600	main_captions	MSRvid	2019	1601	none	none	Uma mulher está fatiando uma pimenta verde	A mulher com uma faca está fatiando uma pimenta	4.4
1599	main_captions	MSRvid	2019	1600	none	none	Um cachorro preto está pulando de uma pedra em uma lagoa	Um cachorro preto está pulando de uma doca para uma lagoa	4.7
1598	main_captions	MSRvid	2019	1599	none	none	A pessoa está andando de moto em uma pista arenosa	A pessoa está dirigindo uma moto em uma trilha de areia	4.9
1596	main_captions	MSRvid	2019	1597	none	none	Uma menina está penteando o cabelo	Uma menina está penteando seu cabelo	4.6
1592	main_captions	MSRvid	2019	1593	none	none	Um homem está limpando a beira de uma tigela	Um homem está limpando a beira da tigela	4.9
1591	main_captions	MSRvid	2019	1592	none	none	Dois cachorros estão lutando por um frisbee em um lago	Dois cachorros castanhos estão brincando com um frisbee na água	4.4
1587	main_captions	MSRvid	2019	1588	none	none	O cachorro castanho está pulando no ar	O animal marrom está pulando no ar	4.4
1586	main_captions	MSRvid	2019	1587	none	none	Um menino está olhando atentamente para o calendário	Um menino está olhando um calendário	4.6
1585	main_captions	MSRvid	2019	1586	none	none	O esquilo está correndo em círculos	Um animal está correndo em círculos	4.3
1584	main_captions	MSRvid	2019	1585	none	none	Os homens estão tendo uma conversa	Os homens estão falando	4.6
1581	main_captions	MSRvid	2019	1582	none	none	Uma família está assistindo um menino pequeno que está batendo em uma bola de beisebol	Uma criança está batendo em uma bola de beisebol	4.1
1580	main_captions	MSRvid	2019	1581	none	none	A pessoa está escrevendo com um lápis	Uma pessoa está escrevendo	4.5
1579	main_captions	MSRvid	2019	1580	none	none	Uma menina pequena está tocando um piano de cauda no palco	Uma menina está tocando o piano	4.3
1578	main_captions	MSRvid	2019	1579	none	none	Dois animais estão correndo pelo parque	Dois cachorros estão correndo rapidamente por um parque	4.5
1576	main_captions	MSRvid	2019	1577	none	none	Uma mulher está fatiando uma berinjela	Uma mulher está fatiando um vegetal	4.3
1575	main_captions	MSRvid	2019	1576	none	none	O praticante de snowboard está saltando corajosamente sobre a neve branca	O praticante de snowboard está saltando sobre da neve branca	4.5
1572	main_captions	MSRvid	2019	1573	none	none	A mulher está pegando um canguru que é pequeno	A mulher está pegando um bebê canguru	4.5
1571	main_captions	MSRvid	2019	1572	none	none	Um homem está comendo comida	Um homem está comendo alguma comida	4.9
1570	main_captions	MSRvid	2019	1571	none	none	Um homem está agachado e segurando uma câmera	Uma pessoa está agachada e segurando a câmera	4.6
1569	main_captions	MSRvid	2019	1570	none	none	Um homem está tirando fotos de um lago	Um homem está atenciosamente tirando fotos de um lago	4.7
1568	main_captions	MSRvid	2019	1569	none	none	Uma abelha está agarrada a uma flor amarela	Uma flor amarela está sendo agarrada por uma abelha	4.6
1567	main_captions	MSRvid	2019	1568	none	none	Um gato está engatinhando debaixo de uma peça de mobiliário	Um animal está rastejando sob uma peça de mobiliário	4.4
1566	main_captions	MSRvid	2019	1567	none	none	Alguém está desenhando uma pessoa	A pessoa está desenhando	4.0
1565	main_captions	MSRvid	2019	1566	none	none	O grupo de pessoas está sentado no chão do lado de fora de um monumento	Algumas pessoas estão sentadas no chão do lado de fora de um monumento	4.9
1564	main_captions	MSRvid	2019	1565	none	none	Um cachorro preto e um cachorro branco e preto pequenino estão olhando para cima para uma bancada de cozinha	Dois cachorros estão olhando para uma bancada de cozinha	4.6
1563	main_captions	MSRvid	2019	1564	none	none	Um cachorro preto está pulando de uma doca para uma lagoa	Um cachorro preto está pulando de uma doca dentro da água	4.4
1562	main_captions	MSRvid	2019	1563	none	none	O oficial militar está gritando com os recrutas	Um oficial está falando com os soldados	4.1
1561	main_captions	MSRvid	2019	1562	none	none	O homem está cuidadosamente alimentando uma cobra com um rato	Uma cobra está sendo alimentada com um rato por um homem	4.8
1558	main_captions	MSRvid	2019	1559	none	none	Uma mulher, que é velha, está perto de um cachorro que tem pelagem branca	Uma mulher, que é velha, está perto de um cachorro branco	4.4
1557	main_captions	MSRvid	2019	1558	none	none	Um grupo de crianças no porão de uma igreja está tocando maracas e tamborins	Um grupo de crianças em um porão de uma construção está tocando maracas e tamborins	4.2
1555	main_captions	MSRvid	2019	1556	none	none	O homem está fatiando vegetais	Os vegetais estão sendo fatiados por um homem	4.9
1552	main_captions	MSRvid	2019	1553	none	none	Uma pessoa em uma bicicleta está pulando pelo ar e o sol está cintilando pela armação da bicicleta	A pessoa está voando pelo ar na bicicleta	4.4
1551	main_captions	MSRvid	2019	1552	none	none	Um homem está dançando lentamente na estrada	Um homem está dançando na estrada	4.7
1550	main_captions	MSRvid	2019	1551	none	none	Um animal castanho e branco está pulando na calçada	Um cachorro castanho e branco está pulando na calçada	4.5
1543	main_captions	MSRvid	2019	1544	none	none	A pessoa está escrevendo	Uma pessoa está escrevendo	4.9
1542	main_captions	MSRvid	2019	1543	none	none	Dois meninos estão no sofá jogando jogos na televisão	Dois meninos no sofá estão jogando vídeo games	4.7
1539	main_captions	MSRvid	2019	1540	none	none	Pessoas estão andando do lado de fora de um prédio que possui muitos murais	Pessoas estão andando do lado de fora do prédio que possui vários murais	4.7
1538	main_captions	MSRvid	2019	1539	none	none	Dois cachorros brancos estão correndo e pulando pela praia	Dois cachorros estão brincando na praia	4.185
1537	main_captions	MSRvid	2019	1538	none	none	Uma criança está surpreendentemente experienciando um mundo novo	Uma criança está experimentando um mundo novo	4.5
1534	main_captions	MSRvid	2019	1535	none	none	O homem está fazendo uma parada de mão na areia molhada na beira da água na praia	Um homem está realizando uma parada de mão na praia	4.1
1532	main_captions	MSRvid	2019	1533	none	none	A mulher está fatiando ervas	Uma mulher está fatiando ervas	4.9
1531	main_captions	MSRvid	2019	1532	none	none	Algumas pessoas estão dançando	Um grupo de pessoas está dançando	4.5
1530	main_captions	MSRvid	2019	1531	none	none	Um cavalo branco está sendo cavalgado por um homem com um chapéu azul de vaqueiro	Um homem em um chapéu azul de vaqueiro está cavalgando um cavalo branco	4.7
1528	main_captions	MSRvid	2019	1529	none	none	Um cachorro está perseguindo uma bola na grama	Uma bola está sendo perseguida por um cachorro na grama	4.9
1526	main_captions	MSRvid	2019	1527	none	none	Duas crianças estão jogando futebol de campo no parque	Duas crianças estão brincando com uma bola no parque	4.2
1525	main_captions	MSRvid	2019	1526	none	none	Um grupo de pessoas está em pé ao redor de uma mesa de som	Um grupo de pessoas está em pé ao redor de uma aparelhagem de som	4.7
1524	main_captions	MSRvid	2019	1525	none	none	Um homem está carregando uma árvore	Um homem está carregando uma planta	4.3
1523	main_captions	MSRvid	2019	1524	none	none	Um menino vestindo shorts vermelho está pulando em uma piscina infantil	Uma criança está vestindo shorts vermelhos e está pulando em uma piscina infantil	4.6
1521	main_captions	MSRvid	2019	1522	none	none	Uma mulher está colocando espetos em uma prateleira	Os espetos estão sendo colocados em uma prateleira por uma mulher	4.9
1520	main_captions	MSRvid	2019	1521	none	none	Um homem está disparando com uma espingarda	Um homem está atirando com uma arma	4.3
1518	main_captions	MSRvid	2019	1519	none	none	O homem com cabelo castanho está usando óculos de sol e está sentado passivamente em uma mesa com latas de refrigerante e outras bebidas	O homem com cabelo castanho está usando óculos de sol e está sentado em uma mesa com latas de refrigerante e outras bebidas	4.4
1512	main_captions	MSRvid	2019	1513	none	none	Uma mulher está amalgamando ovos	Uma mulher está misturando ovos	4.5
1511	main_captions	MSRvid	2019	1512	none	none	A mulher está pegando um bebê canguru	A senhora está pegando o canguru	4.5
1506	main_captions	MSRvid	2019	1507	none	none	Um violão está sendo tocado por um homem	Um homem está tocando violão	4.9
1505	main_captions	MSRvid	2019	1506	none	none	Um homem está cuspindo	Não tem nenhum homem cuspindo	4.1
1503	main_captions	MSRvid	2019	1504	none	none	Uma mulher usando uma camisa azul e saltos altos está de pé na calçada ao lado de um homem	Uma mulher usando camisa azul e saltos altos está de pé na calçada ao lado do homem	4.9
1500	main_captions	MSRvid	2019	1501	none	none	Um bebê está alegremente brincando com um cachorro	Um bebê está brincando com um cachorro	4.7
1499	main_captions	MSRvid	2019	1500	none	none	Um homem está em um navio em frente ao pôr-do-sol	Um homem está em um barco na frente do pôr do sol	4.6
1498	main_captions	MSRvid	2019	1499	none	none	Uma pessoa está tocando um piano	Um piano está sendo tocado por uma pessoa	4.9
1497	main_captions	MSRvid	2019	1498	none	none	Dois meninos no sofá estão jogando vídeo games	Uma dupla de meninos está jogando um videogame	4.4
1496	main_captions	MSRvid	2019	1497	none	none	A menina está passando lápis de olho em sua pálpebra	A menina está usando um lápis para os olhos em sua pálpebra	4.9
1495	main_captions	MSRvid	2019	1496	none	none	O cervo está pulando sobre uma cerca	Um cervo está pulando sobre o recinto	4.535
1494	main_captions	MSRvid	2019	1495	none	none	Um gato está balançando em um ventilador	Um gato está preso em um ventilador de teto móvel	4.3
1493	main_captions	MSRvid	2019	1494	none	none	Uma mulher está olhando a vista de uma cidade	A mulher está olhando a vista de uma cidade	4.9
1492	main_captions	MSRvid	2019	1493	none	none	Duas pessoas estão carregando cestas coloridas e cobertores e andando próximo a um prédio	Duas pessoas estão andando com cestas carregadas e cobertores	4.1
1491	main_captions	MSRvid	2019	1492	none	none	Um cachorro, que é grande e cinza, está carregando uma bola em sua boca com dificuldade e correndo através da grama	Um cachorro, que é grande e cinza, está carregando uma bola na boca e correndo através da grama	4.4
1490	main_captions	MSRvid	2019	1491	none	none	O menino está tocando um violão	Um menino está tocando um violão	4.8
1489	main_captions	MSRvid	2019	1490	none	none	Um homem está dançando de cabeça para baixo no teto	Um homem está dançando no teto de uma sala	4.3
1488	main_captions	MSRvid	2019	1489	none	none	Quatro pessoas estão sentadas em um parapeito baixo de cimento	Algumas pessoas estão sentadas em um parapeito baixo de cimento	4.5
1482	main_captions	MSRvid	2019	1483	none	none	Um palhaço está cantando e pessoas estão dançando	Um palhaço está cantando	4.4
1481	main_captions	MSRvid	2019	1482	none	none	Uma pessoa está acariciando o pelo de um gato	Uma pessoa está penteando o pelo de um gato	4.1
1479	main_captions	MSRvid	2019	1480	none	none	Uma menina pequena e uma mulher vestindo uma camisa amarela estão sendo molhadas por uma fonte da cidade	Uma menina pequena e uma mulher usando uma camisa amarela estão sendo molhadas perto de uma fonte	4.6
1478	main_captions	MSRvid	2019	1479	none	none	Um texugo, que é astuto, está cavando a terra	Um texugo está cavando a terra astutamente	4.5
1477	main_captions	MSRvid	2019	1478	none	none	Uma criança jovem está correndo por uma estrada de cascalho que está coberta com folhas mortas	Uma criança jovem está correndo ao ar livre sobre as folhas caídas	4.1
1476	main_captions	MSRvid	2019	1477	none	none	O homem está dirigindo um carro cuidadosamente	O homem está dirigindo um carro	4.6
1475	main_captions	MSRvid	2019	1476	none	none	Um gato está tocando um piano comicamente	Um gato está tocando um piano	4.5
1474	main_captions	MSRvid	2019	1475	none	none	Uma estudante com uma sacola preta está em um trem lotado	Uma menina com uma sacola preta está em um trem lotado	4.7
1473	main_captions	MSRvid	2019	1474	none	none	Uma caixa de papelão está sendo tocada por um homem com chapéu preto	Um homem com chapéu preto está tocando uma caixa de papelão	4.9
1471	main_captions	MSRvid	2019	1472	none	none	A apresentação não está sendo assistida por uma sala de aula de estudantes	A apresentação está sendo assistida por uma classe de estudantes	4.4
1469	main_captions	MSRvid	2019	1470	none	none	Um cachorro amarelo está correndo por um caminho arenoso	Um cachorro está correndo	4.1
